0	Les États-Unis renforcent leur présence militaire dans le golfe, alors que le président Clinton a discuté de la crise irakienne avec le seul allié qui a soutenu sa menace de force, le Premier ministre britannique Tony Blair.
0	La Nancy Marshall du monde entier rend compte de la visite actuelle de M. Blair à Washington et de la relation particulière entre les deux dirigeants.
0	Le président Clinton a déployé le tapis rouge pour le premier ministre Blair, l'accueillant non seulement comme un proche allié, mais comme un ami proche.
0	Posant pour les photographes avec Clinton, Blair s'est engagé à rester uni au président contre l'Irak, avertissant Saddam Hussein que la menace de la force est réelle.
1	Le porte-avions britannique invincible patrouille maintenant le golfe Persique aux côtés de trois navires américains.
0	Washington et Londres sont pratiquement seuls à avertir l'Irak de frappes militaires s'il ne recule pas sur la question de l'inspection des armes.
0	Le président Clinton affirme que lui et Blair se tiendront ensemble non seulement sur l'Irak mais aussi sur l'arrestation des terroristes soupçonnés d'avoir fait sauter le vol Pan Am un oh trois au-dessus de l'Écosse.
0	Pour The World, je suis Nancy Marshall à Washington.
1	Le journaliste environnemental de l'année du SEC-CDL, Tan Chengli de Malaisie, reçoit le prix de Mme Grace Fu,...
1	J'ai rendu mon dernier respect à notre père fondateur bien-aimé, M. Lee Kwan Yew avec maman cet après-midi...
0	@Joojookxy Non, ce n'est pas le cas.
1	Mais c'est un peu ce qui arrive quand on ne mange pas pendant des jours et que rien ne va dans sa bouche que de la bière.
0	@Hyongt l'obtient
1	Si vous voulez mettre fin à vos achats de Noël tôt, rendez-vous dans notre succursale Oxley ce vendredi, samedi...
1	Le plugin Temasys WebRTC pour Internet Explorer, Safari est maintenant disponible pour licence par les fournisseurs de services et...
1	Je me sens tellement béni que le petit ami est venu me chercher à l'aéroport lorsque j'ai atterri à Singapour aujourd'hui.
1	« Monster Performance » ASUS ZenFone 2 avec 4 Go de RAM au détail à Singapour à partir du 16 mai : « Monster Performance »...
1	Conférence du vendredi de l'ANDA : Membres fondateurs de STUDIO REVOLT
1	Il a survécu 7 jours 6 nuits en Thaïlande, Chiang Mai et Bangkok, et quelques heures au Myanmar et au Laos.
1	J'ai quitté l'école à 8 h 45 Ratteignez la maison 2 heures plus tard, RJ est parti 50 minutes La grippe me tue, Dammit Traffic, embouteillage, tu me gâches la vie
1	Total Assets Protection Inc., qui rebondit par rapport à sa perte antérieure, prévoit déclarer un bénéfice d'exploitation d'environ 200 000$ pour le troisième trimestre, a déclaré J.C. Matlock, président.
0	Le revenu net comprend un gain extraordinaire d'environ 100 000$ résultant de l'inversion des créances douteuses et des revenus d'intérêts.
0	Le chiffre d'affaires était d'environ 4,5 millions de dollars.
1	Au troisième trimestre 1988, la société a enregistré une perte nette de 876 706$, soit 22 cents l'action, sur un chiffre d'affaires d'environ 5,1 millions de dollars.
0	Total Assets planifie et conçoit des centres informatiques, des systèmes de sécurité informatique et des systèmes de sauvegarde informatique.
1	WASHINGTON, 12 mars (Xinhua) — La Pologne, la Hongrie et la République tchèque ont officiellement rejoint l'OTAN vendredi lors d'une cérémonie qui s'est tenue dans la ville d'Indépendance, au Missouri.
0	À la bibliothèque Harry Truman d'Indépendance, les trois ministres des Affaires étrangères de Bronislaw Geremek de Pologne, Janos Martonyi de Hongrie et Jan Kavan, de la République tchèque, ont signé des documents officiels d'adhésion.
0	Dans les discours précédant la cérémonie de signature, les ministres ont déclaré que leur pays considérait l'adhésion à l'OTAN comme une assurance de sécurité et une reconnaissance de la place qui leur revient en Europe.
0	Kavan a déclaré que la République tchèque ne deviendrait plus « la victime impuissante d'une invasion étrangère ».
0	Martonyi a qualifié l'admission de Hunragy à l'OTAN de « retour dans son habitat naturel », déclarant : « Cela a été notre destin manifeste de rejoindre ceux avec qui nous partageons les mêmes valeurs, intérêts et objectifs ».
1	Et Geremek a déclaré que c'était « un grand jour pour la Pologne et pour le monde entier ».
1	aujourd'hui seul... j'ai vu environ 6-7 grands turismo... et l'émission de télévision Channel8 a aussi eu des émissions gts... quoi.
0	le.
1	@HaziqVilla demain, je retourne parce que je n'ai pas d'école
1	Réservation préalable à l'admission Medical Appt pour lundi avant le cours CN1111FC, mais vous avez des travaux inachevés pour continuer le lundi, alors allez au travail puis en classe
1	ASUS remporte neuf prestigieux Red Dot Awards 2015 pour son design de produit exceptionnel : ASUS remporte neuf prestigieux...
0	@feeyawna a vu que tu m'as donné envie de revenir à la boite !
1	Ce lieu me manque) : Haha Je fais du tutorat maintenant !
0	Tu me manques aussi !
0	Sortez un jour !
0	:>
1	General Motors Corp. La grande unité électronique de défense et d'électronique automobile, GM Hughes Electronics, a déclaré que le revenu net a chuté de 22 % au troisième trimestre, reflétant la baisse des dépenses militaires et l'affaissement de la production de véhicules GM.
0	Pendant ce temps, le net de la branche financière de GM, General Motors Acceptance Corp., a chuté de 3,1 %.
0	En revanche, Electronic Data Systems Corp., la filiale de traitement des données de GM, a augmenté le taux net de 16 %.
1	GM a clôturé une baisse de 1,875$ à 44,875$ en bourse de New York hier.
1	Les bénéfices des actions ordinaires de GM, reflétant les performances des principales opérations automobiles de GM, seront dévoilés ce matin.
0	GM Class H, qui représente une participation de dividendes dans les bénéfices de Hughes, a clôturé à 29$, en hausse de 25 cents dans le trading composite Big Board.
0	GM Class E, qui représente un dividende dans le bénéfice d'EDS, a chuté de 75 cents pour atteindre 52,25$ au Big Board.
0	La baisse des bénéfices chez GM Hughes Electronics est le signe d'une période difficile tant dans les opérations de défense de Hughes Aircraft Co. que dans les opérations automobiles nord-américaines de GM, qui sont l'un des principaux clients du côté Delco Electronics Corp. de l'unité GM Hughes.
1	Le bénéfice de l'unité est tombé à 110,6 millions de dollars, soit 37 cents par action, contre 142,4 millions de dollars, soit 45 cents l'action, principalement en raison d'une charge ponctuelle de 24 millions de dollars associée au plan précédemment annoncé par Hughes visant à réduire l'emploi d'au moins 6 000 personnes d'ici la fin de l'année.
0	Même en excluant la charge, le net a chuté de 5 %.
1	De plus, la production de véhicules nord-américains de GM a chuté de 8,4 % par rapport à l'année précédente, ce qui a nui aux bénéfices de Delco Electronic, a indiqué un porte-parole de l'entreprise.
0	Cette baisse s'est reflétée dans le chiffre d'affaires de l'unité GM Hughes, qui est passé de 2,63 milliards de dollars à 2,58 milliards de dollars.
1	Au cours des neuf mois, le taux net de GM Hughes a chuté de 6,6 % à 486,6 millions de dollars, soit 1,48$ par action, contre 521 millions de dollars, soit 1,58$ l'action.
0	Le chiffre d'affaires a augmenté de 3,5 % à 8,47 milliards de dollars, contre 8,18 milliards de dollars.
0	Au GMAC, le net a chuté de 3,1 % à 234,5 millions de dollars, contre 241,9 millions de dollars.
1	L'unité financière a attribué cette baisse à des coûts d'emprunt plus élevés que l'année précédente.
0	GMAC a déclaré que ses activités de financement et de crédit-bail automobiles ont augmenté de 35 % aux États-Unis, principalement en raison des incitations des concessionnaires et des clients utilisés pour stimuler les ventes.
0	Les bénéfices de GMAC sont combinés aux bénéfices du reste des activités de GM et sont attribués aux actions ordinaires traditionnelles de la société.
1	Au cours des neuf premiers mois, le bénéfice de GMAC a chuté de 8 % à 859,5 millions de dollars, contre 930,2 millions de dollars.
1	À EDS, le bénéfice du troisième trimestre a bondi de 16 % pour atteindre un record de 110,9 millions de dollars, soit 93 cents par action, contre 95,9 millions de dollars, soit 79 cents l'action.
0	Le chiffre d'affaires a augmenté de 12 % à 1,37 milliard de dollars, contre 1,22 milliard de dollars.
1	Au cours des neuf mois, EDS a gagné 315,8 millions de dollars, soit 2,62$ par action, en hausse de 13 % par rapport à 280,7 millions de dollars, soit 2,30$ par action.
0	Le chiffre d'affaires a augmenté de 14 % à 4,03 milliards de dollars, contre 3,54 milliards de dollars.
1	Le chiffre d'affaires provenant des comptes non GM représentait 45 % de l'activité totale d'EDS au cours des neuf derniers mois, contre 40 % l'année précédente.
1	La société a déclaré vouloir augmenter le chiffre d'affaires non GM pour atteindre au moins 50 % de son activité totale d'ici la fin de 1990.
1	Maintenant, je sais quoi me procurer à Koi chaque fois que j'ai l'occasion d'y visiter ~ thé au lait caramel 70% de sucre ~
1	UNE HEURE ET TRENTE MINUTES ALLONGÉ SUR MON LIT EN REGARDANT UN FILM GÉNIAL.
1	Passé colonial, guerre à la paix, avenir radieux, magnifique Colombo au Sri Lanka
1	L'outil de traduction en temps réel de Skype parle désormais mandarin et italien #tech
1	Six produits Logitech reconnus par un prix Red Dot 2015 Product Design Award : Six produits Logitech reconnus par...
1	26 startups en Asie qui ont attiré notre attention (15 mars 2015) via @Techinasia
1	Premier troisième jour, je suis à Hong Kong ! ~ Merci FansAndFriends, donnez-moi votre amour et votre cadeau pour moi ~I'm so touch~ T.T
1	@petrovaxx Un jour, je serai dans cette maison en permanence..:)
1	Control Data Corp., qui, il y a quelques mois, avait une hémorragie financière, pense qu'elle sera suffisamment saine pour envisager de rachetter la dette publique.
1	De plus, l'entreprise, dont l'approche autonome s'est presque révélée fatale, considère désormais les alliances avec d'autres personnes comme le chemin du retour à la prospérité dans ce qu'elle appelle les « solutions de données ».
0	« Je ne dis pas que tout est dégueulasse, mais nous avons terminé la transition », a déclaré Robert M. Price, président-directeur général, dans une interview.
1	La « transition » fait référence à l'effort de restructuration quinquennal de l'entreprise.
1	Au cours de cette période, Control Data a subi des pertes de plus d'un milliard de dollars.
1	Maintenant, suite aux ventes d'actifs qui ont diminué de plus d'un tiers cette année seulement, Control Data est à l'affût de liquidités.
1	Ses dirigeants parlent donc ouvertement de racheter une partie des 172,5 millions de dollars de débentures convertibles subordonnées de l'entreprise l'année prochaine.
0	« Nous aimerions continuer à réduire la dette », a déclaré le président Lawrence Perlman.
0	Notant que l'entreprise propose de racheter 154,2 millions de dollars en billets de haut niveau payant 12 3/4%, il a dit que la réponse aidera à déterminer les futurs efforts de réduction de la dette.
1	L'offre a été automatiquement déclenchée par la récente vente de l'activité de disques Imprimis de Control Data à Seagate Technology Inc. M. Perlman, qui est également directeur financier par intérim et le favori pour devenir le prochain chef de la direction, a déclaré que la société obtient « un flux de trésorerie modeste positif à partir de et nous nous attendons à ce que cela se poursuive en 1990. »
1	Il a dit que l'entreprise n'a pas l'intention de mettre sur écoute ses lignes bancaires à court terme « pendant une bonne partie de 1990 ».
1	L'année prochaine, Control Data « développera une nouvelle relation bancaire », a déclaré M. Perlman.
1	Ces derniers mois, un groupe de prêteurs, dirigé par Bank of America, a étendu les données de contrôle jusqu'à 90 millions de dollars en prêts renouvelables jusqu'en janvier, ainsi que 115 millions de dollars en lettres de crédit de réserve.
0	Les pactes de prêt exigent que l'entreprise atteigne des niveaux précis de bénéfice d'exploitation et qu'elle respecte un test de rentabilité continu de quatre trimestres.
1	La semaine dernière, Control Data a enregistré un bénéfice du troisième trimestre de 9,8 millions de dollars, soit 23 cents l'action, sur un chiffre d'affaires de 763 millions de dollars.
1	Au cours des neuf premiers mois, l'entreprise a subi une perte de 484 millions de dollars, principalement en raison de la fermeture de son unité de supercalculateur.
0	Alors que quelques actifs sont encore en cours de magasinage, y compris la partie billetterie pour les sports et les divertissements de l'unité Tickétron de l'entreprise, M. Price a déclaré que la restructuration future serait une question de stratégie.
0	« Nous n'avons pas besoin de l'argent. »
0	L'activité de paris automatisés de Ticketron, qui exploite des loteries dans une demi-douzaine d'États, n'est pas à vendre, a précisé la société.
0	Selon M. Perlman, Control Data a plutôt l'intention de soumissionner pour le prochain contrat de loterie du Minnesota et cherche de nouvelles applications pour la technologie à l'étranger, où « les jeux d'adresse suscitent un grand intérêt ».
0	Il n'a pas voulu élaborer.
0	L'activité de semi-conducteurs de Control Data, VTC Inc., continue de perdre de l'argent, ont reconnu les dirigeants, mais ils ont dit qu'ils considèrent que certaines technologies sont essentielles à la défense nationale et sont donc réticents à s'en débarrasser.
1	La stratégie de l'entreprise visant à maintenir la rentabilité de ses activités de produits informatiques — elle a récemment atteint sa rentabilité après plusieurs trimestres de pertes \ — exige une attention étroite et une réduction des dépenses.
0	En partie, les coûts seront réduits grâce à des alliances technologiques stratégiques, a déclaré la direction.
1	Control Data a récemment annoncé un accord avec MIPS Computer Systems Inc. pour développer conjointement des machines avec un logiciel d'exploitation simplifié.
1	James E. Ousley, président du groupe des produits informatiques, a déclaré que de tels arrangements pourraient contribuer à réduire de moitié les coûts de recherche et de développement informatiques de Control Data d'ici la fin de 1990.
1	Il a révélé qu'avant que Control Data ne met fin à son activité de supercalculateur ETA Systems Inc. au printemps dernier, ces coûts s'établissaient à près de 35% du chiffre d'affaires du groupe.
0	En même temps, quatre des six projets de conception ont été grimpés, a-t-il dit.
0	Interrogé sur la façon dont l'entreprise espère développer son activité de matériel informatique, M. Ousley a déclaré qu'elle voit de bonnes opportunités en matière d'intégration des systèmes.
0	« Nous pensons que nous ne recevons que 10% des dollars d'intégration que nos clients dépensent », a-t-il dit.
0	« Nous sommes dans des environnements qui vont dépenser beaucoup d'argent là-dessus. »
0	Les mainframes Control Data sont conçus pour les utilisateurs informatiques à intensité numérique intensive, tels que les communautés scientifiques, d'ingénierie et universitaires.
0	La gestion des services publics est un créneau commercial majeur.
0	Après avoir passé en revue l'égratignure de l'entreprise avec le désastre, M. Price a reconnu qu'elle avait essayé d'en faire trop seule.
0	« Absolument », a-t-il dit.
0	Mais alors que son action se vend à environ la moitié de la valeur de rupture estimée de Control Data, ni MM. Perlman ni Price n'ont dit qu'il passait beaucoup de temps à envisager la possibilité d'une prise de contrôle hostile.
0	« Nous sommes inscrits comme candidats depuis si longtemps que cela ne vaut pas la peine de s'inquiéter », a déclaré M. Price.
0	La combinaison d'une alimentation saine et de pratique du yoga peut inverser le vieillissement.
1	Vivez une vie saine et pratiquez-vous maintenant il n'est jamais trop tard !
0	Donc vous pensez pouvoir danser pour une cause ? ? ?
1	Pour la Journée Hug A Shark de cette année, Sharks Savers Singapore sera...
0	WTF 3 récompenses à la fois ?
1	Découvrez les avantages du yoga à travers ce diagramme et inscrivez-vous à votre cours de yoga gratuit dès maintenant !
1	J'ai sauté les cours aujourd'hui.
0	@ Université Ehwa
0	Votre point de vue actuel n'est pas limité par la convention sociale n... Encore plus pour Libra
1	Bébé, ne perdez pas votre temps. Je sais ce que vous pensez, je suis peut-être qualifié pour un stand d'une nuit, mais je ne pourrais jamais prendre la place de votre homme.
1	Des détails supplémentaires sur le massacre sont apparus dimanche.
0	L'avocat de Slepian, Glenn Edward Murray, a déclaré que la balle du tireur d'élite est entrée par une fenêtre de cuisine partiellement drapée, a frappé Slepian dans le dos et est sorti par sa poitrine.
0	La femme du médecin et l'un de ses fils étaient dans la cuisine lorsque la fusillade s'est produite, a précisé Murray.
0	La balle a rebondi d'une armoire et a ricoché dans le salon, où les trois autres enfants du médecin regardaient la télévision, a précisé Murray.
0	La femme de Slepian et un fils ont essayé de le ranimer.
1	Un peu plus d'une heure plus tard, il a été déclaré mort à l'hôpital de banlieue Millard Fillmore voisin.
0	Dans la plupart des cas, les personnes des deux côtés de la question de l'avortement ont exprimé leur indignation face à la fusillade.
0	Mais un adversaire de l'avortement, le révérend.
0	Donald Spitz, le fondateur de Pro-Life Virginia, a décrit le tueur de Slepian comme un « héros » pour avoir terminé la « pratique assoiffée de sang » du médecin.
0	« En tant que chrétiens, nous avons la responsabilité de protéger les innocents contre le meurtre », a déclaré Spitz dans un communiqué publié à The Associated Press, « de la même façon que nous voudrions que quelqu'un nous protège.
0	Celui qui a tiré le coup de feu a protégé les enfants. »
0	La plupart des autres opposants à l'avortement ont cependant condamné la fusillade et l'avortement.
1	Lors de sa messe du dimanche à la cathédrale Saint-Patrick de New York, le cardinal John O'Connor a qualifié le meurtre de mal mais il a exhorté les personnes en colère par le meurtre à être tout aussi irritées par les avortements.
0	« Il a appelé beaucoup de ces mêmes personnes à exprimer leur indignation face à l'avortement partiel à la naissance, qu'il a appelé l'équivalent de l'infanticide », a déclaré Joseph Zwilling, porte-parole de l'archidiocèse de New York, à propos du sermon du cardinal.
0	Les chefs religieux de Buffalo ont également condamné la fusillade.
0	Mgr Henry Mansell, de l'archidiocèse de Buffalo, a déclaré qu'il s'agissait d'un « acte de folie », mais il a poursuivi en défendant l'opposition de l'Église à l'avortement comme « respectant la vie humaine sous toutes ses formes, en particulier les plus vulnérables ».
0	Susan Dudley, directrice adjointe de la Fédération nationale de l'avortement, a attaqué les propos et a appelé les groupes anti-avortement à changer de tactique.
0	Elle a déclaré que la rhétorique du mouvement anti-avortement a contribué à mener à de violentes attaques contre les fournisseurs d'avortement.
0	« Je pense que lorsque les organisations pro-vie essaient de faire la distinction entre elles-mêmes et ces incidents, elles sont au mieux malfaisantes », a-t-elle dit.
0	« Ce sont eux qui appellent ces médecins meurtriers. »
0	À Amherst, les habitants qui ont dit s'opposer à l'avortement ont dénoncé l'attaque et ont dit espérer que l'auteur de l'infraction était pris.
0	Les hommes qui fument des cigares et buvant de la bière avec des amis après avoir tiré sur le skeet au Buffalo Shooting Club d'Amherst ont déclaré que leurs sentiments à l'égard de l'avortement étaient mitigés, mais ils ont uniformément dénoncé le meurtre de Slepian.
1	De nombreux résidents ont déclaré que l'avortement avait progressivement diminué en tant que problème local depuis que l'opération Rescue, un groupe anti-avortement, a lancé en 1992 une série de démonstrations « Printemps de vie » qui avaient pour but de fermer les cliniques d'avortement et de harceler les médecins locaux, y compris Slepian.
1	Le vitriol que la question a suscité à la fin des années 1980 et au début des années 1990 demeure peu de vitriol, selon les habitants, et bon nombre des chefs religieux locaux qui ont dirigé les manifestations de 1992 ont évolué.
0	« Les seules personnes qui restent sont les gens durs et fanatiques », a déclaré Larry Finkelstien, un professeur de lycée qui travaille comme escorte dans les cliniques d'avortement.
0	« Tout le monde est parti. »
1	De longues heures de travail nous font boire plus #health #trends
1	Maintenant, nous devons marquer les feuilles de travail du laboratoire de votre élève.
1	Je suis maintenant le professeur Fung
1	#SgWine | vin spécial pour ce soir : Rolf Binder 2004 Heysen Barossa Valley Shiraz, un vin de notre...
0	Dîner à Ikea avec maman et Sissy !
1	Joyeux vendredi soir !
1	L'animateur chinois, Pi San, visite @tischasia Animation and Digital Arts le 11 octobre 2013
1	La beauté d'aujourd'hui au terminal 1 de l'aéroport de Changi 1 le #projectairports @ Aéroport de Changi Terminal 1 Départ
1	DD Acquisition Corp., un partenariat d'Unicorp Canada Corp. s Kingsbridge Capital Group et Cara Operations Ltd., ont prolongé jusqu'au 20 novembre son offre de 45$ par action pour toutes les actions Dunkin' Donuts Inc. en circulation.
1	L'offre, qui devait expirer hier, est conditionnelle au fait que 50,1 % des actions ordinaires de Dunkin, sur une base entièrement diluée, soient soumissionnées et au retrait du plan de protection contre les pilules empoisonnées de la société.
0	L'acquisition a lancé un procès devant un tribunal du Delaware pour demander le retrait des droits de pilule empoisonnée de Dunkin et des plans de propriété des employés, qui, selon elle, ont été mis en place pour dissuader les soumissionnaires.
0	L'acquisition a indiqué que 2,2 millions d'actions, soit environ 38,5 % des actions en circulation, ont été soumissionnés dans le cadre de son offre.
1	Les partenaires ont indiqué qu'ils détiennent déjà 15 % de toutes les actions en circulation.
1	Dunkin' a fixé au 10 novembre la date limite de réception des offres concurrentes.
0	DD Acquisition a déclaré que l'extension doit permettre la réalisation de ce processus.
0	Dunkin' est basé à Randolph, Massachusetts.
0	Cara, exploitante de la chaîne de services alimentaires et Unicorp, une société holding, sont basées à Toronto.
1	MOSCOU (AP) _ Les présidents ukrainiens Leonid Koutchma et Boris Eltsine de Russie ont signé vendredi un plan de coopération économique, et Eltsine a affirmé qu'ils avaient résolu des problèmes encore plus lancinants.
1	La Russie et l'Ukraine partagent des cultures et des langues similaires, et l'Ukraine a été gouvernée de Moscou pendant des siècles.
0	Mais si les deux voisins slaves se considèrent comme des partenaires naturels, leurs relations depuis l'éclatement de l'Union soviétique ont été envahies par un certain nombre de différends : bases navales de la mer Noire, problèmes frontaliers et dettes de gaz naturel de l'Ukraine.
0	« Nous avons couvert toute la liste des questions et discuté de la façon dont nous allons les aborder », a déclaré Eltsine par l'agence de presse Itar-TASS.
0	« Je dois dire qu'il n'y a plus de problèmes instables.
0	Nous les avons tous résolus. »
0	Mais sa déclaration radicale ne contenait aucun détail, et ne donnait aucune indication sur la façon dont les différends pouvaient être résolus.
0	Leur solution nécessiterait un compromis entre les parlements des deux nations.
1	Un différend majeur concerne un vaste traité politique appelant à la démarcation des frontières, que les deux présidents ont signé en mai dernier.
0	En fait, le traité équivaut à la reconnaissance russe de la souveraineté et des frontières de l'Ukraine, et le parlement ukrainien l'a déjà ratifié.
1	Cependant, la Russie a bloqué la ratification, essayant de le lier à un accord qui permettrait à la marine russe d'utiliser une base navale sur la péninsule de Crimée en Ukraine pendant au moins 20 ans de plus.
0	Dans leur déclaration commune publiée après les pourparlers, Eltsine et Koutchma ont appelé à la ratification la plus rapide possible du traité, affirmant qu'il créerait une « base juridique solide » pour les liens bilatéraux et contribuerait à la stabilité en Europe.
0	Koutchma a assuré à Eltsine que l'Ukraine ne rejoindrait pas l'OTAN, a déclaré le porte-parole d'Eltsine Sergueï Yastrzhembsky, selon l'agence de presse Interfax.
0	Les dirigeants russes se sont fermement opposés à l'expansion de l'alliance occidentale en Europe de l'Est.
0	Dans leur déclaration commune, publiée par le Kremlin, les deux dirigeants se sont également engagés à se consulter régulièrement sur leur approche des relations avec l'OTAN et, en particulier, leur action dans le cadre du programme Partenariat pour la paix de l'OTAN.
