1	Je n'ai pas couru depuis 16 jours et 23 jours depuis que je me suis blessé
1	hindi pa din tapos ang vendredi ko noooooooo
1	| PTN de l'année 3 ~ tout le monde va manquer !
0	#PTN #speye @ Polytechnique de Singapour
1	Merci #Apple 4 a réparé mon #macbookpro 2011 GRATUIT même si la garantie avait expiré il y a longtemps.
0	Un service incroyable !
0	Je ne vous abandonnerai jamais !
1	። Pour la cuisine amusante aujourd'hui, nous avons fabriqué des biscuits à thème ; des biscuits de plage et de pluie pour K1 et K2።
0	Le gouvernement britannique a officiellement demandé que le Sinn Fein, l'aile politique de l'IRA, soit expulsé des pourparlers de paix multipartites sur l'Irlande du Nord.
1	Cette décision était largement attendue après que la police d'Irlande du Nord a déclaré croire que l'IRA était à l'origine de deux meurtres à Belfast la semaine dernière.
0	Le président du Sinn Fein, Mitchell McLaughlin, affirme que le parti contestera cette décision par des moyens légaux s'il le faut.
0	Nous allons le combattre.
0	Et euh, nous avons déjà très fortement contesté les termes dans lesquels cela a été présenté.
0	Mais nous contestons cela au motif que euh le RUC a donné un avis, et cette opinion va servir de mécanisme pour nous éjecter des pourparlers, et c'est très grave.
0	Toute décision d'expulser le Sinn Fein doit être approuvée conjointement par les gouvernements de la Grande-Bretagne et de la République d'Irlande.
1	Je veux juste faire une longue promenade la nuit avec quelqu'un de proche.
0	Vous voulez rejoindre le 64e championnat de cross-country de l'ASA EPN !
0	C'est tellement cool !
1	Commence à 8 heures du matin, je vais devoir me précipiter à la discussion Common Eng dans NUS à 11h si je pars
1	Lace and Ebony se rapproche maintenant de vous, au cœur de la ville de BlogShopping @ Far East Plaza.
0	Profitez du...
0	Bon sang, Lloyden.
1	tellement de chance aujourd'hui.
0	De grands mouvements, depuis mais pas de bons, mec.
0	#BAONPDX
0	Intel Corp. » La puce la plus puissante présente des défauts qui pourraient retarder les efforts marketing de plusieurs fabricants d'ordinateurs, mais les « bogues » ne devraient pas nuire à Intel et à la plupart des fabricants d'ordinateurs.
1	Les experts en informatique familiers avec les défauts trouvés dans la puce 80486 d'Intel affirment que les défauts n'affectent pas l'utilisateur moyen et sont susceptibles d'être corrigés avant que la plupart des ordinateurs utilisant la puce alors que leurs « cerveaux » apparaissent sur le marché l'année prochaine.
1	Intel a déclaré que la semaine dernière, un client a découvert deux défauts dans l' « unité à virgule flottante » de sa puce à microprocesseur 80486, un ensemble de circuits qui effectuent certains calculs.
1	Vendredi, Intel a commencé à informer les clients des bogues qui font que la puce donne de mauvaises réponses à certains calculs mathématiques.
0	Mais alors qu'International Business Machines Corp. et Compaq Computer Corp. affirment que les bogues vont retarder les produits, la plupart des grands fabricants d'ordinateurs ont déclaré que les défauts ne les affectent pas.
0	« Des bogues comme celui-ci ne sont qu'une partie normale du développement de produits », a déclaré Richard Archuleta, directeur de Hewlett-Packard Co. » est le développement de systèmes avancés.
1	Hewlett a annoncé la semaine dernière qu'elle prévoyait d'expédier un ordinateur basé sur la puce 486 au début de l'année prochaine.
0	« Ces bugs n'affectent pas du tout notre emploi du temps », a-t-il dit.
0	De même, AST Research Inc. et Sun Microsystems Inc. ont déclaré que les bogues ne retarderont pas leur développement de machines basées sur 486.
0	« Nous n'avons aucunement modifié nos horaires », a déclaré un porte-parole de Sun.
0	Passer aux puces d'un autre vendeur, « ne serait certainement pas une option », a-t-il dit.
1	Néanmoins, l'inquiétude concernant la puce pourrait être à l'origine d'une baisse de 87,5 cents des actions d'Intel à 32 dollars l'action hier dans le commerce en vente libre, sur un volume de 3 609 800 actions, et en partie responsable d'une baisse des actions de Compaq dans le trading composite de la Bourse de New York mercredi.
1	Hier, Compaq a plongé plus loin, clôturant à 100$ l'action, sur 8,625$ l'action, sur un volume de 2 633 700 actions.
1	La majeure partie de la baisse de Compaq est attribuée à un rapport de résultat du troisième trimestre qui a atteint le bas niveau des attentes des analystes.
1	Intel a déclaré qu'il avait corrigé les problèmes et qu'il commencerait à produire des puces sans bugless la semaine prochaine.
0	« Nous ne devrions plus en voir plus », a déclaré Bill Rash, directeur de la puce 486 chez Intel.
0	Qui plus est, les bogues n'émergent que sur des applications ésotériques telles que la conception assistée par ordinateur et les calculs scientifiques, a-t-il dit, puis très rarement.
0	« Ces errata n'affectent pas les programmes d'affaires », a-t-il dit.
0	Ces bogues causeront des problèmes dans « des circonstances spécifiques et rares qui ne se produiront pas dans des applications typiques », comme le traitement de texte et les feuilles de calcul, a déclaré Michael Slater, rédacteur en chef du rapport sur les microprocesseurs, un bulletin de l'industrie.
0	Sun, Hewlett-Packard et d'autres affirment qu'Intel n'est pas entièrement responsable du Snafu.
0	Les vrais coupables, ont-ils dit, sont les fabricants d'ordinateurs comme IBM qui ont sauté le pistolet pour dévoiler des produits basés sur 486.
0	« La raison pour laquelle cette visibilité est si importante est que certains ont commencé à expédier et ont annoncé une disponibilité anticipée », a déclaré M. Archuleta de Hewlett-Packard.
0	« Vous pouvez le faire, mais vous prenez un risque.
0	Ces entreprises paient le prix pour prendre le risque. »
1	Fin septembre, IBM a commencé à expédier une carte plug-in qui convertit son modèle PS/2 70-A21 d'une machine 80386 à une machine 80486.
1	Une porte-parole d'IBM a déclaré que l'entreprise avait parlé lundi des bugs aux clients et a temporairement cessé d'expédier le produit.
0	IBM n'a pas l'intention de rappeler ses cartes complémentaires, a indiqué la porte-parole, et pourrait probablement contourner les bogues sans retards de produits longs.
0	« Nous ne considérons pas cela comme un problème majeur pour nous », a-t-elle dit.
1	Compaq, qui a dit avoir découvert les bugs, prévoit toujours d'annoncer 486 nouveaux produits le 6 novembre.
0	En raison du problème, l'entreprise a toutefois déclaré ne pas savoir quand sa machine sera disponible dans le commerce.
0	C'est une rupture avec la tradition Compaq, car l'entreprise n'annonce pas de produits avant d'être chez les revendeurs.
0	Selon les experts, le problème se pose, car le 486 est le futur phare d'Intel.
0	Les microprocesseurs Intel sont les puces de prédilection dans de nombreux ordinateurs personnels actuels et le microprocesseur 80486 est le fer de lance de l'offre de l'entreprise pour protéger cette place dans la prochaine génération de machines.
0	« Bien que ce genre de bogues ne soit pas rare du tout, le 486 est un produit extrêmement médiatisé », a déclaré M. Slater, rédacteur en chef du bulletin d'information.
1	La puce 80486 d'Intel est la Corvette des microprocesseurs Intel, une puce ultra-rapide et très coûteuse que seuls les utilisateurs d'ordinateurs les plus gourmands d'énergie sont susceptibles d'acheter depuis au moins plusieurs années.
1	Dévoilée en avril dernier, la puce engloutit 1,2 million de transistors sur un morceau de silicium, soit quatre fois plus que sur le modèle précédent d'Intel, le 80386.
0	Intel montre la vitesse de la puce à 15 millions d'instructions par seconde, ou MIP.
0	C'est quatre fois plus rapide que le 386.
0	Les machines utilisant le 486 devraient défier les postes de travail et les miniordinateurs à prix plus élevé dans des applications telles que les serveurs appelés serveurs, qui connectent des groupes d'ordinateurs ensemble, et dans la conception assistée par ordinateur.
0	Mais bien que la vitesse de traitement de la puce soit éblouissante, sa véritable force réside dans son héritage logiciel.
0	Le 486 est le descendant d'une longue série de puces Intel qui ont commencé à dominer le marché depuis qu'IBM a choisi la puce 8088 16 bits pour son premier ordinateur personnel.
0	(Un microprocesseur 16 bits traite 16 données à la fois et est plus lent que les puces 32 bits plus récentes.)
0	Depuis, Intel a acculé une grande partie du marché avec des générations successives de puces 16 et 32 bits, qui peuvent toutes exécuter des logiciels écrits pour des modèles précédents.
0	C'est ce qui permettra aux fabricants d'ordinateurs d'arriver malgré l'irritation des insectes.
1	De grands fabricants d'ordinateurs personnels et de nombreux fabricants de postes de travail d'ingénierie développent des machines basées sur 486, qui devraient arriver sur le marché au début de l'année prochaine.
0	Parmi les grands fabricants d'ordinateurs, seule Apple Computer Co. base ses machines sur des puces Motorola.
0	« Le 486 va avoir un impact important sur l'industrie », a déclaré M. Archuleta de Hewlett-Packard.
1	« Ce sera la technologie de pointe des ordinateurs personnels pour les prochaines années.
0	Ce bogue n'aura aucune incidence là-dessus. »
0	Andy Zipser de Dallas a contribué à cet article.
1	Unisys Corp. L'annonce vendredi d'une perte de 648,2 millions de dollars pour le troisième trimestre a montré que l'entreprise avance encore plus vite que prévu pour prendre des radiations sur ses différents problèmes et se préparer à un revirement l'année prochaine.
0	Dans le même temps, l'ampleur de la perte, associée à un ralentissement des ordres, a amené certains analystes de valeurs mobilières à se demander à quel point ce revirement sera fort au niveau des préoccupations des fabricants d'ordinateurs et de l'électronique de défense.
0	« Unisys est en train de se faire bouffer.
0	Tout simplement bouffé », a déclaré Ulric Weil, analyste chez Weil amp Associates qui était autrefois à la hauteur de l'entreprise.
0	« Le quartier était terrible, et l'avenir semble tout sauf encourageant. »
1	Unisys, dont le chiffre d'affaires a augmenté de 3,7 % au cours du trimestre à 2,35 milliards de dollars par rapport à 2,27 milliards de dollars au trimestre précédent, a enregistré une perte d'exploitation d'environ 30 millions de dollars.
0	En plus de cela, l'inquiétude de Blue Bell, Pennsylvanie, a pris une charge de 230 millions de dollars liée aux licenciements de 8 000 employés.
1	C'est au sommet de la fourchette de 7 000 à 8 000 employés qui, selon Unisys, seraient licenciés il y a un mois.
0	Unisys a déclaré que cela devrait aider à économiser 500 millions de dollars par année en coûts, encore une fois au sommet de la fourchette précédemment signalée de 400 millions de dollars à 500 millions de dollars.
0	La société a également pris une amortissement de 150 millions de dollars pour couvrir les pertes sur certains contrats de défense à prix fixe, car certains nouveaux gestionnaires ont jeté un regard attentif sur les perspectives de cette activité à croissance lente.
0	En outre, Unisys a mis en place une réserve non spécifiée — apparemment de 60 à 70 millions de dollars — pour couvrir le montant minimum qu'il devra payer au gouvernement en raison de son implication dans le scandale des achats de défense.
1	Unisys a également noté qu'elle a payé 78,8 millions de dollars d'impôts au cours du trimestre, même si les paiements d'impôts seraient normalement minimes au cours d'un trimestre qui a entraîné une perte aussi importante.
1	Les paiements d'impôt laisseront à Unisys 225 millions de dollars en report de pertes qui réduiront les paiements d'impôt au cours des prochains trimestres.
1	En outre, Unisys a déclaré qu'elle avait réduit les stocks informatiques de 100 millions de dollars supplémentaires au cours du trimestre, ce qui laisse à 100 millions de dollars son objectif de réduction de 500 millions de dollars d'ici la fin de l'année.
1	Néanmoins, Unisys a déclaré que ses activités européennes étaient faibles au cours du trimestre, ce qui est un signe inquiétant étant donné que l'entreprise s'est appuyée sur des résultats solides à l'étranger pour surmonter la faiblesse des États-Unis au cours des derniers trimestres.
0	La société a également enregistré un ralentissement de la croissance dans une autre activité importante : les systèmes utilisant le système d'exploitation Unix.
0	Ce serait un énorme problème s'il devait continuer, car Unisys parie ses activités sur l'hypothèse que les clients veulent s'éloigner de l'utilisation de systèmes d'exploitation fonctionnant sur un seul équipement du fabricant et vers des systèmes, principalement Unix, qui fonctionnent sur presque n'importe qui.
0	En outre, Unisys doit faire face à son endettement de plus en plus oppressif.
0	La dette a atteint environ 4 milliards de dollars, soit environ 50 % de la capitalisation totale.
1	Cela signifie qu'Unisys doit verser environ 100 millions de dollars d'intérêts chaque trimestre, en plus de 27 millions de dollars de dividendes sur actions privilégiées.
0	Jim Unruh, le président d'Unisys, a dit approcher l'an prochain avec prudence.
0	Il a dit que la force de l'économie mondiale est suspecte, et ne voit pas beaucoup de croissance des revenus dans les cartes.
1	Il a également déclaré que les guerres des prix qui éclatent dans certaines parties de l'industrie informatique se poursuivront jusqu'à l'année prochaine.
0	Il a dit que le passage vers des systèmes d'exploitation standard signifie que les clients ne sont pas enfermés à acheter auprès de leur fournisseur d'ordinateurs traditionnel et peuvent forcer les prix à la baisse.
0	C'est pourquoi Unisys est en train de remanier l'ensemble de son activité : elle doit se préparer à un monde dans lequel les marges bénéficiaires seront inférieures à celles auxquelles les entreprises informatiques ont été habituées.
0	« Nous avons abordé cette question non pas comme une réponse à une situation temporaire dans l'industrie, mais comme un changement fondamental que traverse l'industrie », a déclaré M. Unruh.
0	« Le secteur des systèmes d'information continue de connaître une forte croissance, et nous sommes convaincus que nous disposons d'énormes atouts en tant qu'entreprise.
1	Mais nous ne minimisons pas les défis à court terme. »
1	Les analystes des valeurs mobilières se sont montrés encore plus prudents, ayant été brûlés à plusieurs reprises sur Unisys cette année.
1	Certains avaient prévu un bénéfice de plus de 4$ par action pour cette année, en hausse par rapport à 3,27$ complètement dilué de l'année dernière par action sur le bénéfice de 680,6 millions de dollars.
1	Mais la société a déclaré vendredi avoir subi des pertes de 673,3 millions de dollars au cours des neuf premiers mois, contre un bénéfice de 382,2 millions de dollars l'année précédente, soit 2,22$ l'action complètement diluée, le chiffre d'affaires ayant augmenté de 1,4 % à 7,13 milliards de dollars, contre 7,03 milliards de dollars.
1	Et Unisys ne devrait guère faire mieux que de s'élever au quatrième trimestre.
1	Steve Milunovich de First Boston a donc dit qu'il réduisait son estimation des gains pour l'an prochain à 2$ l'action contre 3$.
0	« J'avais l'impression d'être trop haut pour commencer », a-t-il dit.
1	M. Weil, de Weil amp Associates, a dit qu'il restera à 1$ l'action pour l'an prochain mais a dit se demander si même cette cible faible est à risque.
1	« Le seuil de seuil pour l'année prochaine est beaucoup plus faible, mais est-il suffisamment bas ? »
0	a-t-il demandé.
1	Compte tenu de cette inquiétude, les actions d'Unisys ont chuté de 75 cents supplémentaires à 16,25$ en négociation composite vendredi à la Bourse de New York.
0	Les séances de rencontre impromptues avec mes amis de l'école secondaire sont le meilleur chat tellement que ma gorge me fait mal.
0	La SEC demande à tous les parents de jeter un coup d'œil à ce que Disney Junior réserve à vos petits...
1	La première prise de photos après plusieurs mois n'a pas pu prendre correctement Lieu : toit d'un...
1	Marquez les 16 et 19 octobre 2014 sur vos calendriers.
0	Le Singapore Environment Council participera au 5e...
1	RYO (Beat Buddy Boi) est #fnnsdd5 Prelims Judge et il tiendra un atelier Hip Hop le 27 avril.
1	Obtenez des conseils maintenant !
0	:
1	Le matin, j'avais fait pipi dans mon lit et j'ai dû nettoyer ça avec ma tante qui me lancinait dessus.
0	C'était avant que je me réveille d'un mauvais rêve.
1	Rejoignez le célèbre professeur et podcaster Dave Farmar pour un week-end puissant de Baptiste Power Vinyasa Yoga, du 1er au 3 novembre.
0	Polly Peck International Inc. » L'accord d'acquisition de 51 % de Sansui Electric Co. prouve que les entreprises étrangères peuvent acquérir des entreprises japonaises, si l'alternative à la société japonaise est l'extinction.
0	Polly Peck, un conglomérat britannique en pleine croissance, versera 15,6 milliards de yens (110 millions de dollars) pour 39 millions de nouvelles actions de Sansui, un fabricant bien connu d'équipements audio haute fidélité qui n'a pas réussi à s'adapter à l'évolution des conditions du marché.
0	Les responsables du gouvernement japonais, désireux de réfuter les critiques étrangères à l'égard des investissements japonais à l'étranger, ont salué cette transaction comme preuve que les étrangers peuvent réaliser des investissements similaires au Japon.
1	Le président de Polly Peck, Asil Nadir, a fait écho à la vision officielle japonaise de l'accord, qui a été annoncée vendredi.
0	« Les mythes selon lesquels le Japon n'est pas ouvert à des préoccupations extérieures ont, je pense, été démoli d'un coup », a déclaré M. Nadir.
0	Mais les analystes disent que Sansui est un cas particulier.
1	Elle prévoit une perte de 6,4 milliards de yens pour l'année se terminant demain et ses passifs dépassent actuellement ses actifs d'environ 13,8 milliards de yens.
0	« Si vous trouvez des entreprises saines et saines au Japon, elles ne sont pas à vendre », a déclaré George Watanabe, consultant en gestion chez Asia Advisory Services Inc. Les statistiques sur les acquisitions effectuées par des étrangers varient en détail, car contrairement à Sansui, qui est cotée sur les bourses de Tokyo et d'Osaka, la plupart des Les entreprises japonaises acquises par des étrangers sont privées.
1	Mais de toute évidence, les entreprises étrangères n'ont acheté qu'une poignée relative de sociétés japonaises cette année, tandis que des entreprises japonaises ont acquis des centaines de sociétés étrangères.
0	Les analystes ne s'attendent pas non plus à ce que l'accord Sansui déclenche une nouvelle vague d'achats étrangers.
0	Si le yen fort et les cours élevés des actions des entreprises japonaises n'étaient pas suffisamment dissuasifs, des réseaux de participations croisées entre des entreprises japonaises amicales et des attitudes d'entreprises japonaises farouchement indépendantes repoussent la plupart des acquéreurs potentiels.
0	Habituellement, lorsqu'une entreprise japonaise est prête à vendre, il reste peu d'alternatives, et le comportement sinistre des dirigeants de Sansui lors d'une conférence de presse commune ici ne laissait guère douter que ce n'était pas l'heure la plus belle de l'entreprise.
0	Sansui était autrefois l'un des premiers fabricants japonais d'équipements stéréo coûteux et de haute qualité pour les audiophiles.
1	Mais ces dernières années, le marché s'est orienté vers des ensembles de « mini-composants » moins chers, des amplificateurs et récepteurs miniaturisés et des lecteurs logiciels qui pourraient être empilés les uns sur les autres.
0	Certaines des autres sociétés audiospécialisées de Sansui, telles que Aiwa Co. et Pioneer Electric Corp., ont répondu au défi en mettant rapidement en place leurs propres produits à mini-composants, en se déplaçant fortement dans les entreprises de disques compacts en plein essor ou en se diversifiant dans d'autres domaines de l'électronique grand public, y compris disques laser ou lecteurs de cassettes portables.
0	Sansui était en retard dans le secteur des mini-composants et n'a pas réussi à se lancer dans d'autres nouvelles entreprises.
1	Alors que le yen a grimpé ces dernières années, l'aggravation des problèmes financiers de Sansui est devenue un cercle vicieux.
0	Alors que les concurrents ont déplacé la production à l'étranger en réponse à l'affaissement de la compétitivité des usines japonaises, Sansui n'a pas eu l'argent nécessaire pour construire de nouvelles usines en Asie du Sud-Est.
0	« Notre entreprise n'a pas été en mesure de faire face très efficacement aux changements survenus sur le marché », a déclaré Ryosuke Ito, président de Sansui.
0	Mais même une entreprise japonaise qui ressemble à un chien peut s'avérer être un bon investissement pour une entreprise étrangère, affirment certains conseillers en gestion.
1	Yoshihisa Murasawa, consultant en gestion pour Booz-Allen amp Hamilton (Japan) Inc., a déclaré que son cabinet recommandera probablement des acquisitions d'entreprises japonaises plus souvent à des clients étrangers à l'avenir.
0	« Les attitudes {envers l'acquisition} sont toujours négatives, mais elles deviennent plus positives », a déclaré M. Murasawa.
0	« Dans certains secteurs, comme les produits pharmaceutiques, les acquisitions ont du sens. »
0	Reste à savoir si l'acquisition de Polly Peck a du sens, mais lors de la conférence de presse, M. Nadir a débordé de confiance en lui qu'il peut renverser Sansui.
0	Sansui, a-t-il dit, convient parfaitement aux opérations électroniques de Polly Peck, qui fabriquent des téléviseurs, des magnétoscopes, des micro-ondes et d'autres produits sur une base de « fabricant d'équipement d'origine » à vendre sous les noms de marque d'autres entreprises.
0	Il a déclaré que Polly Peck élargira considérablement la gamme de produits de Sansui, en utilisant les ingénieurs de Sansui pour concevoir les nouveaux produits, et déplacera la production de Sansui de la plupart des produits autres que les équipements audio sophistiqués à l'étranger dans les propres usines de Polly Peck.
0	« Quel que soit le capital dont il (Sansui) a besoin pour être concurrentiel et devenir une entité totalement mondiale capable de rivaliser avec les meilleurs au monde, ce capital sera injecté », a déclaré M. Nadir.
0	Et bien que Polly Peck ne perde pas la structure de direction existante de Sansui, elle fait appel à un ancien dirigeant de Toshiba Corp. en tant que vice-présidente exécutive et chef de l'exploitation.
0	Une telle prise de risques est une affaire quotidienne pour l'audacieux M. Nadir, qui est propriétaire à 25% de Polly Peck ainsi que son président.
1	Il a pris Polly Peck, jadis petit grossiste de tissus, et l'a utilisé comme base pour construire un conglomérat qui double ses profits chaque année depuis 1980.
1	En septembre, il a annoncé son intention d'acquérir les activités de fruits tropicaux de RJR Nabisco Inc. » l'unité alimentaire Del Monte pour #557 millions de dollars (878 millions de dollars).
1	Le mois dernier, Polly Peck a enregistré une hausse de 38 % du bénéfice avant impôt pour le premier semestre à #54 ,8 millions contre #39 ,8 millions, avec une hausse de 63 % des ventes.
0	Joann S. Lublin de Londres a contribué à cet article.
1	Notre série de vidéos de la campagne EnVision a remporté les Straits Times Digital Life Awards 2015...
1	Dîner de Noël - vous sentir béni au Sahara Seesha Bar @ Boat Quay
1	Maintenant, pour le quiz de géographie d'aujourd'hui.
0	Nous sommes à la recherche d'une ville ancienne et exotique.
0	Un également officiellement sanctionné.
0	L'UNESCO l'a déclaré site protégé pour sa beauté et son importance historique.
1	La ville aurait pu utiliser une protection spéciale dans dix-neuf soixante-dix-neuf ans lorsque l'Union soviétique a envahi l'Afghanistan.
1	La plupart des monuments de la ville ont été détruits, y compris une magnifique mosquée carrelée, qui a dominé la ligne d'horizon pendant des siècles.
0	Les gens ici sont célèbres dans toute l'Asie centrale pour leur habileté à façonner la poterie et le carrelage, le verre également.
1	Certaines familles gardent leurs secrets de travail du verre depuis plus de deux mille ans.
0	Même si cette ville se trouve en Afghanistan, la plupart des gens ici parlent un dialecte de la langue persane et entretiennent des liens culturels de longue date avec l'Iran voisin.
0	Tu crois que tu l'as eu ?
1	Eh bien, franchement, je ne le sais pas, mais la réponse arrive dans quelques minutes.
0	Imran Ahmad, Nikon Pro et photographe ESCAPEINC dans le journal national des Seychelles.
1	Date : 21 mai 2013
0	Cilcorp Inc., Peoria, Illinois, a déclaré avoir accepté d'acquérir les activités de conseil en environnement et de services analytiques de Hunter Environmental Services Inc. de Southport, au Connecticule.
0	La holding de services publics a indiqué que Hunter recevra 390 000 actions d'une nouvelle série d'actions privilégiées convertibles Cilcorp d'une valeur nominale de 39 millions de dollars pour les entreprises.
