0	Rassemblement du personnel actuel et ancien du MDIS UE !
0	Super Meetup Peeps !
1	Je n'ai pas réalisé que j'avais autant de jouets sur mon lit maintenant.
0	Pas étonnant qu'il y ait toujours si peu d'espace pour moi.
1	። Lundi dernier papa m'a acheté des beignets pop pour moi et maman bébé ; mais la chose triste c'est que je ne peux pas le manger parce que je suis aussi...
1	Flipboard, votre magazine personnel, est désormais disponible gratuitement dans le Windows Phone Store : Flipboard, votre...
1	week-ends de Woooo à Marsiling
1	Un jour, je marchais très lentement dans la rue, j'ai pensé que ce serait drôle de regarder en bas et de regarder mes pieds. Alors je...
0	ATLANTA _ Bon pour la procureure générale Janet Reno pour l'opinion sensée qu'elle a rendue dans le cas d'Elian Gonzalez.
0	Un semblant d'ordre constitutionnel était nécessaire après qu'un juge de Miami eut tourné la logique juridique sur la tête dans un effort pour diriger vers son tribunal de la famille l'appel de ses proches de Floride pour maintenir l'enfant de 6 ans aux États-Unis.
0	Après tout, l'immigration est strictement fédérale.
0	Si l'ordonnance du Service de l'immigration et de la naturalisation selon laquelle Elian doit être renvoyé à son père à Cuba doit être contestée, Reno a jugé à juste titre que le seul lieu approprié est le tribunal fédéral, et non l'État ou le local.
0	Si et lorsque l'appel des proches est saisi d'un tribunal fédéral, les chances d'une décision favorable sont minces.
0	Tout d'abord, l'INS a déjà pris la position que la seule personne qui peut demander l'asile américain pour Elian est son père, ce qu'il n'est pas sur le point de faire.
0	En outre, la loi sur l'immigration prévoit que l'asile ne peut être accordé que lorsqu'il existe une menace imminente de torture ou de persécution dans la patrie du requérant, ce que personne ne s'attend dans le cas d'Elian.
0	Il ne suffit pas de soutenir qu'Elian risque de subir une privation ou une oppression dans l'État communiste raté de Fidel Castro.
0	L'INS renvoie régulièrement des immigrants potentiels dans des pays où la pauvreté et la tyrannie sont pires qu'à Cuba.
1	Ce qui importe le plus, c'est qu'Elian, après avoir perdu sa mère et son beau-père lors d'un voyage en mer désastreux aux États-Unis en novembre dernier, a besoin de l'amour et des soins des membres de sa famille survivants qui l'ont connu toute sa vie, son père et ses deux groupes de grands-parents à Cuba.
0	Certes, ils ne peuvent pas lui donner toutes les choses matérielles que ses bienfaiteurs de Miami peuvent, mais il y a des intangibles dans les liens familiaux étroits qui sont plus précieux que les vélos et les voyages à Disney World.
0	Le prochain ordre du jour du ministère de la Justice et de l'INS consiste à résoudre rapidement le cas d'Elian.
0	Ils ne doivent pas subir de retards de la part des avocats pour ses proches de Miami.
0	Il a été séparé de ses proches depuis trop longtemps.
0	En outre, plus son retour est repoussé, plus les chances d'ingérence en calculant les membres du Congrès jouant dans le lobby anti-Castro sont grandes.
0	Un grand républicain de l'Indiana a déjà assigné Elian à témoigner devant un panel de la Chambre, et d'autres au Sénat se préparent à voter la citoyenneté américaine.
0	Les deux stratagèmes visent à contrecarrer ses retrouvailles avec son père.
1	Le Congrès se réunit à nouveau le 24 janvier.
0	Le ministère de la Justice et l'INS ne doivent pas permettre aux opportunistes du Capitole d'entrer dans Elian.
0	Faites place à une nouvelle jupe maxi sur le bloc !
1	Une maxi jupe fendue dans notre nouvelle collection plus tard à midi !...
0	Arte mo Mademoiselle... #gabbyapostol
1	Yoga Mummies, Jennie, Wendy, Frances et Margaret se sont réunis la semaine dernière !
0	Ne pensez-vous pas qu'ils ont tous l'air si radieux ?
1	Belle soirée avec l'équipe et @BretFurio à Kudeta.
0	Vue lumineuse, superbe perspective
1	Il y a un nouvel épisode tous les jours !
0	Je n'ai pas souscrit à ce drame.
0	Arrêtez ça !
0	#pissed #depressed
1	Attendez que l'école commence un vendredi ?
1	Triste premier jour a déjà eu CCA
1	Amdahl Corp., un fabricant d'ordinateurs mainframe, a enregistré une forte baisse du revenu net pour son troisième trimestre, invoquant une baisse des prix de la part de ses concurrents et des effets néfastes d'un dollar américain fort.
1	Le bénéfice net a chuté de 37 % à 32,9 millions de dollars, soit 30 cents par action, contre 52,2 millions de dollars, soit 48 cents par action, au cours de la période d'il y a un an.
0	Les revenus ont augmenté de 15 % à 534,3 millions de dollars, contre 464,7 millions de dollars.
0	Les résultats d'Amdahl ont été quelque peu pires que prévu.
1	Jay Stevens, analyste chez Dean Witter Reynolds, a dit s'attendre à ce que la société de Sunnyvale, en Californie, gagne 35 cents l'action pour le trimestre et a déclaré que le bénéfice plus faible de la firme était en partie le résultat d'une concurrence accrue d'International Business Machines Corp., principal concurrent d'Amdahl pour les ventes de mainframes .
1	Pour fêter le début du printemps En manteau d'hiver avec gants sur terrasse à Amsterdam...
0	Ridicule
1	Bonne chance à tous les coureurs qui font le TNF City Run ce soleil !
1	Les bénéfices de Delta Air Lines ont grimpé de 33 % pour atteindre un record au premier trimestre fiscal, ce qui a enrayé la tendance de l'industrie à la baisse des bénéfices.
1	La compagnie aérienne basée à Atlanta, la troisième plus importante des États-Unis, a attribué l'augmentation du trafic passagers, de nouvelles liaisons internationales et du service réduit de la part de sa rivale Eastern Airlines, qui est en faillite à la suite d'une grève qui a débuté le printemps dernier.
1	Pour le trimestre terminé le 30 septembre, Delta affichait un bénéfice net de 133,1 millions de dollars, soit 2,53$ par action, contre 100 millions de dollars, ou 2,03$ par action, l'année précédente.
0	Le chiffre d'affaires a augmenté de 15 % à 2,17 milliards de dollars, contre 1,89 milliard de dollars.
1	Au cours du trimestre, Delta a émis 2,5 millions d'actions ordinaires à Swissair et a racheté 1,1 million d'actions destinées à être utilisées dans un plan d'actionnariat des employés de la société.
0	« La clé du chiffre d'affaires record de Delta a continué d'être une excellente croissance du chiffre d'affaires des passagers », a déclaré Thomas Roeck, directeur financier.
0	Le trafic de passagers a bondi de 14 % au cours du trimestre, tandis que le bénéfice par passager a augmenté de 2 %.
0	Delta a bénéficié plus que les autres transporteurs de la faiblesse d'Eastern Airlines, qui partage le hub d'Atlanta.
1	Bien que Eastern soit de retour à environ 80 % de son calendrier d'avant-frappe, la filiale de Texas Air Corp. commençait tout juste à se remettre sur pied au cours du trimestre.
1	Par ailleurs, America West Airlines, Phoenix, Ariz., a déclaré que le bénéfice du troisième trimestre a bondi de 45 % à 5,8 millions de dollars, soit 28 cents par action, contre 4 millions de dollars, soit 24 cents l'action, un an plus tôt.
0	Les derniers résultats comprennent un paiement unique de 2,6 millions de dollars d'une « entité étrangère ».
0	America West n'a pas voulu identifier l'entité, mais a déclaré que le paiement concernait l'utilisation par la société étrangère de certains avantages fiscaux liés aux achats d'avions America West.
1	Les résultats de l'année précédente comprenaient un gain extraordinaire de 1,6 million de dollars provenant d'un rachat de débentures subordonnées convertibles.
0	Le chiffre d'affaires a augmenté de 21 % à 243,4 millions de dollars, contre 201,2 millions de dollars.
1	Au cours des neuf mois, America West a enregistré un bénéfice de 18,9 millions de dollars, soit 97 cents l'action, contre 9,7 millions de dollars, soit 74 cents l'action, un an plus tôt.
0	Le chiffre d'affaires a augmenté de 27 % à 715,1 millions de dollars, contre 563,8 millions de dollars.
1	J'ai besoin de Starbucks maintenant ! ! ! !
1	Développer des techniques d'enseignement créatives avec Andrey dans le cadre de la formation Universal® Yoga à Shanghai du 6 au 30 décembre.
1	Vous préférez garder les choses légères et faciles maintenant, mais... Encore plus pour Libra
1	Les week-ends, tous les bus sont lents.
0	Professeur de Pure Yoga Shanghai, Shiva in Pure Apparel.
1	Nous lancerons à Shanghai en octobre, alors restez à l'écoute des mises à jour !
0	J'ai juste couru 10 km dans ce magnifique endroit.
1	Cela fait des mois... Les personnes doivent arrêter de me rappeler que j'ai mis un...
1	Pratiquer le piano à cette heure haha.
0	Espérons que la police ne viendra pas frapper..
1	Au fait, ça va aller 1 h du matin.
1	Marathon Harry Potter maintenant !
1	Échangez vos points dès aujourd'hui et profitez d'un rendez-vous au cinéma Shaw Theatres !
1	Photo : Ci-dessus : regarder la ville s'obscurcir au coucher du soleil depuis le belvédère du mont Coot-Tha.
0	Ci-dessous : Prendre notre pizza...
0	L'ancien chef de l'épargne et des prêts, Charles Keating, est confronté à de plus en plus de problèmes juridiques en Californie.
0	Une cour d'appel fédérale a rétabli ses condamnations d'État pour fraude en valeurs mobilières.
0	Elaine Corey, de NPR, a plus de San Francisco.
1	En dix-neuf dix-neuf dix-neuf, Charles Keating a été reconnu coupable devant le tribunal de l'État pour avoir aidé à frauder des milliers d'investisseurs qui ont acheté des obligations à risque élevé vendues par les employés de Keating à Lincoln Savings and Loan.
0	Les obligations sont devenues sans valeur lorsque l'argent des faillites a été saisi par les régulateurs gouvernementaux.
1	Les condamnations de Keating ont été rejetées en dix-neuf quatre-vingt-seize sur une base technique.
0	Et sur cette base, Keating a été libéré de prison avant d'être admissible à une libération conditionnelle.
1	Maintenant, la neuvième cour d'appel du circuit américain a statué que l'appel initial était vicié puisqu'il a soulevé des questions qui n'avaient pas été soulevées auparavant.
0	Cela signifie que les condamnations sont maintenantes, une décision susceptible de renvoyer les avocats de Keating devant le tribunal de l'État où ils doivent commencer par un nouvel appel.
0	Elaine Corey, NPR news, San Francisco.
1	#HiCollage @fotorusofficial MON DERNIER JEUDI PASSÉ KOPITIAM À SAUTER DES ŒUFS OMELETTE AU RIZ ET AU PORC BARBECUE...
0	Les directeurs de Cineplex Odeon Corp. ont déclaré que le président-directeur général de la société, Garth Drabinsky, envisage de soumissionner 780,6 millions de dollars canadiens (666 millions de dollars américains) pour l'acquérir.
0	Le conseil d'administration a déclaré que M. Drabinsky et le vice-président Myron Gottlieb négocient un financement avant d'offrir 16,40$ CA l'action pour acquérir toutes les actions de Cineplex en circulation.
0	Les administrateurs ont ajouté que les deux dirigeants n'ont pas pris la décision finale de procéder à une offre et que jusqu'à ce qu'une offre soit faite, le conseil continuera de rechercher des offres plus élevées auprès d'autres soumissionnaires.
1	Les administrateurs ont déclaré que si MM. Drabinsky et Gottlieb envoient une offre aux actionnaires avant le 22 novembre, ils leur rembourseront un maximum de 8,5 millions de dollars canadiens pour les dépenses liées à une offre.
1	« Nous considérons que sa candidature est une offre acceptable », a déclaré Sandra Kolber, porte-parole du comité des administrateurs indépendants nommé en mai dernier pour solliciter et examiner des offres pour l'entreprise dans la foulée d'un différend entre M. Drabinsky et l'actionnaire majeur de Cineplex, MCA Inc. MCA et l'autre grand actionnaire de Cineplex actionnaire, le financier montréalais Charles Bronfman et ses associés, ont accepté de soumissionner leurs participations à une offre de M. Drabinsky à moins qu'une offre plus élevée ne soit faite par un autre soumissionnaire.
0	MCA détient la moitié des actions de Cineplex et 33 % de ses droits de vote par le biais d'actions avec droit de vote restreint, tandis que les actions Bronfman détiennent environ 24 % des capitaux propres de la société.
0	Mme Kolber a déclaré que le comité avait reçu d'autres offres.
0	Elle a refusé d'identifier d'autres soumissionnaires mais a déclaré que l'offre de M. Drabinsky « est entièrement en espèces, et c'est pour toute l'entreprise ».
0	Plusieurs analystes de Cineplex ont émis l'hypothèse que les offres extérieures reçues par le comité étaient soit décevantes, soit pour une partie seulement de l'entreprise.
0	« Tout cela a vraiment établi, c'est que MCA et les Bronfmans se sont mis d'accord sur un prix auquel ils peuvent être rachetés », a déclaré Jeffery Logsdon, analyste chez Crowell, Weedon à Los Angeles.
0	« Si une offre se concrétise à ce prix, les actionnaires auront toutes les raisons d'être heureux, mais la question du financement demeure. »
1	En avril dernier, M. Drabinsky et un groupe de bailleurs de fonds avaient prévu d'acquérir jusqu'à 30,2 % de Cineplex pour 17,50$ CA l'action des associés de Bronfman.
1	M. Drabinsky, qui aurait eu le droit de voter ces actions pendant deux ans, a déclaré que l'achat, par la suite rejeté par les régulateurs, visait à consolider son contrôle sur l'entreprise.
0	MCA s'est fortement opposée à l'initiative du groupe Drabinsky.
0	Les réalisateurs n'ont pas indiqué la source de financement de la nouvelle proposition de M. Drabinsky, mais ont déclaré que MCA et les associés de Bronfman ont accepté en principe d'acheter 57 millions de dollars, puis de louer à Cineplex son complexe théâtral de 18 écrans à Universal City, en Californie, si M. Drabinsky réussit une offre.
0	« Cela se fait à la suggestion de {M. Drabinsky} et pour l'accommoder, pour faciliter ses arrangements de financement », a déclaré Mme Kolber.
0	En outre, les réalisateurs ont déclaré que si une offre de M. Drabinsky est couronnée de succès, Cineplex s'attend à ce que Rank Organisation PLC acquière 51 % de l'unité Film House de Cineplex qu'elle ne possède pas, et fournira à M. Drabinsky un financement de prêt supplémentaire.
0	Michael Gifford, directeur général de Rank, a déclaré que la participation totale de la chaîne de théâtre britannique « ne dépasserait pas 100 millions de dollars », mais a refusé de donner une ventilation entre le financement du prêt et le projet d'achat de Film House.
1	Les actionnaires de Cineplex ont répondu froidement à l'annonce d'hier.
0	En négociant à la Bourse de New York, Cineplex a clôturé à 11$, en baisse de 25 cents, avec plus d'un million d'actions changeant de mains.
0	À la Bourse de Toronto, Cineplex a clôturé à 12,875$ CA, sur 37,5 cents canadiens, bien en dessous du niveau de 16,40$ CA.
0	« Où est l'offre ? »
0	a demandé Pierre Panet-Raymond, analyste et courtier chez le courtier en valeurs mobilières torontois McDermid St. Lawrence Ltd. M. Panet-Raymond a dit qu'il ne pense pas que MM. Drabinsky et Gottlieb soient « près » d'arranger le financement et que les investisseurs auront besoin d'une offre solide avant que l'action ne recommence à augmenter.
0	M. Drabinsky n'a pas pu être contacté pour faire des commentaires.
1	'@RobHarris : Falcao aujourd'hui : « Je suis très fier d'être à Manchester United.
1	Nous sommes en pourparlers avec le club depuis quelques mois » lol Bullshit
1	Les responsables de l'application de la loi fédérale ont déclaré mercredi avoir conclu que James Kopp, un opposant passionné et nomade à l'avortement, a tiré les coups de feu qui ont tué un médecin de la clinique d'avortement de Buffalo, dans l'État de New York, en octobre dernier.
1	Sur la base de preuves physiques _ y compris un fusil retrouvé le mois d'avril enterré près de la maison du médecin et une correspondance entre des fibres retrouvées près du meurtre et d'autres personnes retrouvées dans la voiture de Kopp _ les responsables ont dit qu'ils avaient décidé d'émettre un mandat d'arrêt contre son meurtre dans le meurtre du Dr Barnett Slepian.
0	Kopp, un fugitif, n'a jusqu'ici été décrit que comme un témoin matériel et un mandat national avait été délivré afin qu'il puisse être détenu pour interrogatoire.
1	Il n'y a pas eu de confirmation officielle de la décision de mettre à niveau le mandat, mais Denise O'Donnell, la procureure américaine du Western District of New York à Buffalo, a programmé une conférence de presse jeudi pour annoncer un « développement majeur » de l'enquête sur le meurtre de Slepian.
0	Le procureur du comté d'Érié Frank Clark, Bernard Tolbert, l'agent spécial du FBI en charge du bureau de Buffalo et d'autres enquêteurs seront également présents.
0	Comme il n'existe pas de loi fédérale sur l'homicide en tant que telle, les responsables fédéraux ont déclaré que Kopp pourrait être inculpé en vertu de la récente loi sur la liberté d'accès aux entrées des cliniques, qui prévoit une peine pouvant aller jusqu'à la prison à perpétuité pour une personne reconnue coupable d'agressions physiques ou de menaces contre les prestataires d'avortement.
0	Si Kopp était également inculpé et reconnu coupable de meurtre de l'État, il pourrait encourir la peine de mort.
1	Slepian, un obstétricien et gynécologue de 52 ans qui était le pilier de la seule clinique d'avortement de Buffalo, a été tué par balle dans la nuit du 23 octobre alors qu'il se tenait dans la cuisine de sa maison de la banlieue d'Amherst, dans l'État de New York, en discutant avec sa femme et l'un de ses quatre fils.
0	Aucune arme n'a été récupérée lors des premières perquisitions policières dans la zone autour du domicile de Slepian.
1	Mais le 8 avril, les enquêteurs, se demandant comment l'assaillant aurait pu sortir des bois sans craindre qu'on le voie portant un fusil, ont fouillé une fois de plus le site de la fusillade et mis au jour un fusil enterré à un pied sous terre à 200 pieds derrière la maison Slepian.
1	Clark, le procureur du district d'Érié, a déclaré par la suite que les enquêteurs pensent que le tueur du médecin a enterré le fusil dans les jours précédant la fusillade, a mis au jour l'arme pour tirer les coups de feu mortels, puis l'a réenterré à la hâte et s'est enfui.
1	Kopp, 44 ans, qui, sur les photographies du FBI, apparaît comme dégueulasse et scrupuleusement barbu et dont les dernières adresses connues étaient au Vermont et au New Jersey, est apparu au centre de l'enquête dans les deux semaines qui ont suivi le meurtre.
1	Un jogger a observé la voiture de Kopp à 6 heures du matin.
1	près de la maison de Slepian 10 jours avant le meurtre et, curieux de savoir pourquoi un étranger y serait garé si tôt, a écrit le numéro de plaque d'immatriculation.
1	Compaq Computer Corp. a déclaré que son bénéfice net a augmenté de 51 % au troisième trimestre, soutenu par des gains inhabituels de son investissement dans un fabricant de disques et reflétant la croissance continue de ses opérations européennes.
1	Selon le fabricant d'ordinateurs, le net a bondi à 87 millions de dollars, soit 2,02$ par action, contre 58 millions de dollars, soit 1,40$ l'action, un an plus tôt.
0	Les ventes ont augmenté de 36 % à 683 millions de dollars, contre 502 millions de dollars.
1	Les résultats du dernier trimestre, cependant, comprenaient un gain avant impôts de 13,7 millions de dollars, soit 20 cents l'action, de la valeur comptable de l'investissement de la société dans Conner Peripherals Inc. et un gain de 7,6 millions de dollars, soit 11 cents l'action, résultant de la vente d'un million d'actions Conner.
1	Le montant net pour les neuf mois s'élevait à 254 millions de dollars, soit 5,94$ par action, en hausse de 56 % par rapport à 163 millions de dollars, soit 4,06$ l'action, l'année précédente.
0	Les ventes ont augmenté de 50 % à 2,1 milliards de dollars, contre 1,4 milliard de dollars.
1	Le montant net des neuf mois précédents comprenait également un gain de 9,7 millions de dollars, soit 15 cents l'action, de la valeur comptable de l'investissement Conner.
1	Michael Shavely, président de la division Amérique du Nord de Compaq, a attribué la performance de l'entreprise au troisième trimestre à la hausse continue des ventes internationales, qui représentaient 43 % des ventes de l'entreprise, soit une augmentation de 74 % par rapport à l'année précédente.
1	« Au cours des deux prochaines années, nous ne serions pas surpris de voir l'Europe et les {ventes} internationales représentent 50% du chiffre d'affaires de l'entreprise », a-t-il dit.
1	Au cours du troisième trimestre, Compaq a acheté une ancienne usine de fabrication Wang Laboratories à Stirling, en Écosse, qui sera utilisée pour des opérations internationales de service et de réparation.
0	M. Shavely a déclaré que le nouvel espace permettra à Compaq d'augmenter la capacité de fabrication de son usine d'Erskine, en Écosse.
1	Dans le trading composite de la Bourse de New York hier, les actions Compaq ont chuté de 1,625$ à 108 625$.
1	VENDREDI 13... COMMENT TU M'AIMES BIEN MAINTENANT.
0	Ancienne technique avec un soupçon de créativité.
0	(Macro de bague inversée) Nous sommes...
1	። Déjeuner hier.
0	Troisième partie.
0	Total : 10 pax። @ Dix-huit chefs
1	J'ai envie de hacher des oignons et de les manger crus en ce moment.
0	@Joojookxy
1	@lorenzo99 Une percée à l'horizon ce week-end ?
0	Voyez comment les abeilles « attaquent » leurs ennemis.
0	Je vous souhaite tout le meilleur à vous et Rossi !
0	SDD Vol.
1	Le 4 Fan Choice Award se termine ce vendredi soir, 2359 ! !
1	OBTENEZ CES VOTES MAINTENANT ! !
0	(vote sur le site de bureau FB)
1	Service Corp. International a déclaré qu'elle s'attend à déclarer un bénéfice net de 15 cents l'action pour le troisième trimestre.
1	La société a indiqué qu'elle prévoit publier ses résultats du troisième trimestre à la mi-novembre.
1	L'opérateur du salon funéraire et du cimetière est passé d'un exercice financier à une année civile en décembre.
1	Au cours du trimestre comparable de l'année précédente, le deuxième trimestre terminé le 31 octobre, Service Corp. a subi une perte d'environ 12,5 millions de dollars, soit 26 cents l'action, sur un chiffre d'affaires de 175,4 millions de dollars.
1	Les résultats de ce trimestre comprenaient une note de 30 millions de dollars, soit 40 cents l'action, associée à la consolidation d'une installation.
1	Carrefour fermera les deux points de vente d'ici la fin du mois
1	Tisch Asia au Festival du film de la Nouvelle-Orléans 2014
0	Diversified Investment Group Inc. a déclaré avoir accepté d'être racheté par Star States Corp. pour des actions évaluées à 13,75$ l'action, soit environ 24,4 millions de dollars.
0	Diversified, la société holding de Fidelity Federal Savings amp Loan Association, a déclaré que l'accord donne également à Star States la possibilité d'acquérir 588 300 des 1 774 326 actions en circulation de Diversified « dans certaines circonstances ».
0	L'acquisition donnerait Wilmington, Del. accès au marché de Pennsylvanie basé à Star States.
0	L'accord est soumis à l'approbation réglementaire et à la résolution des poursuites intentées par certains détenteurs diversifiés dans le cadre de la fusion proposée.
1	Le tournage de ce soir Cr : @i .shootandrun C'était une séance photo amusante et un meilleur rattrapage avec mon ami photographe...
1	Moi : J'espère que mon avenir ne regarde pas le football Bff : Bonne chance d'avoir une chatte en tant que mari Moi : Je suis un dick wat
1	LE SOMMET DES ALPES EST PARVENU APRÈS 2,5 HEURES DE TREKKING, CONSIDÉRANT QUE NOUS AVONS PRIS LE RACCOURCI C'EST TOUT...
1	Il est pluvieux et malheureux, ici, dans la région d'Orchard... #SgWeatherWatch #Singapore #boringtweet
0	Quand j'étais petit, je voulais grandir.
1	Maintenant, je me rends compte qu'un genou meurtri était bien meilleur qu'un cœur brisé.
1	LA HAVANE (AP) — Qualifiant la mère d'Elian Gonzalez d' « excellente fille », le président Fidel Castro a déclaré vendredi qu'elle avait été « pratiquement kidnappée » par le petit ami qui a péri avec elle sur l'épave du bateau que son fils de 6 ans a survécu.
0	Les remarques de Castro lors d'une conférence d'économistes s'adressaient à ceux qui disent qu'Elian devrait rester aux États-Unis parce que sa mère a sacrifié sa vie pour l'emmener à la « liberté », une vision qu'il a qualifiée de cliché.
0	Il a mis le blâme sur Lazaro Rafael Munero, qui a apparemment organisé le voyage maladroit au cours duquel la mère d'Elian Elisabeth Brotons et 10 autres personnes, dont Munero, sont mortes.
0	Castro a qualifié Munero — qui aurait conduit un taxi et se livrait à des entreprises non officielles dans la ville cubaine de Cardenas — de « ruffien » sur lequel la police cubaine avait amassé « 100 pages de rapports ».
1	Selon des sources citées par le Miami Herald, Munero s'était enfui en Floride en juin 1998 et est retourné à Cuba plus tard cette année-là, pour être emprisonné pendant plusieurs mois.
1	« La mère a pratiquement été kidnappée avec le garçon » pour faire le voyage de fin novembre, a déclaré Castro.
0	Le dirigeant cubain a déclaré qu'Elian avait été particulièrement aimé de ses parents parce que la mère avait déjà subi sept fausses couches.
