1	J'ai vendu une robe bonite d'amour à cette heure-ci. L'acheteur s'est rendu chez moi en bas pour me procurer la robe.. incroyable !
0	O.O
0	Ma'al Hijrah à tous les adeptes musulmans.
1	1435 #Hijrah.
1	Jour 1 du RNR : Chemin de fer de la mort de la Thaïlande à la Birmanie
0	Les détenteurs de Dominion Textile Inc. ont adopté un plan de droits des actionnaires lors de l'assemblée annuelle.
1	La pilule dite poison est entrée en vigueur le 9 août en attendant sa ratification par les détenteurs.
0	Des droits attachés aux actions ordinaires de la société ont été émis et sont déclenchés si un soumissionnaire hostile acquiert plus de 20 % des actions en circulation.
1	Une fois déclenchés, les droits permettent aux détenteurs d'acheter des actions supplémentaires à 50 % du prix actuel du marché ou, à la discrétion du conseil, de recevoir des titres ou des actifs.
1	Par ailleurs, Dominion Textile a affiché un bénéfice net de 4,7 millions de dollars canadiens (4 millions de dollars), soit 12 cents canadiens par action, pour le premier trimestre financier terminé le 30 septembre.
1	L'entreprise a subi une perte nette de 2,3 millions de dollars canadiens, soit 14 cents canadiens l'action, il y a un an.
1	Les ventes ont atteint 348,2 millions de dollars canadiens contre 307,2 dollars canadiens l'année précédente.
1	REJOIGNEZ LE COURS DE RÉFORMATEUR DE TOUTES LES POPULATIONS 2 \ - 3 mai, 9 \ - 10, 16 \ - 17, 23 \ - 24, 30 \ - 31 mai (sam-dim 13h00-18h)...
1	Approfondissez notre pratique en tant que Maître Entraîneur Kenneth Sicat, aidez-nous dans le voyage de Core Flow Yoga le 10 mai 2014 à 14h...
1	De Pont Co. a indiqué que le bénéfice du troisième trimestre a augmenté de 19 % par rapport à l'année précédente, grâce aux activités de l'entreprise dans divers produits chimiques et fibres, ainsi que dans le pétrole.
0	Du Pont a également porté son dividende trimestriel à 1,20$ l'action contre 1,05$, un changement qui augmentera le versement annualisé aux actionnaires de quelque 140 millions de dollars.
0	Du Pont, contrairement aux entreprises gravement touchantes par les fortes baisses de prix des produits chimiques de base et des plastiques, bénéficie de son large éventail d'activités.
0	La hausse des bénéfices a été réalisée malgré un affaiblissement du marché du logement, pour lequel l'entreprise est fournisseur, et un renforcement du dollar, ce qui réduit la valeur des bénéfices à l'étranger lorsqu'ils sont convertis en dollars.
0	La société Wilmington, Del., a déclaré un montant net de 547 millions de dollars, soit 2,36 dollars par action, ce qui était conforme aux estimations de Wall Street.
1	Au cours de la période précédente, la société a gagné 461 millions de dollars, soit 1,91$ l'action.
1	Les ventes au dernier trimestre ont atteint 8,59 milliards de dollars, en hausse de 9,4 % par rapport à 7,85 milliards de dollars.
1	L'augmentation des dividendes a été la deuxième de Du Pont cette année, une affirmation des déclarations des dirigeants supérieurs selon lesquelles ils ont l'intention d'augmenter les récompenses aux actionnaires.
1	« Nous n'avons pas autant profité à l'actionnaire que nous en avons besoin », a déclaré Edgar Woolard Jr., président et chef de la direction de Du Pont, dans une interview plusieurs mois avant qu'il n'entre à son poste actuel en avril.
0	Le principal bénéficiaire sera Seagram Co., qui détient environ 23 % de Du Pont.
1	Un porte-parole de Seagram, le secteur des vins et spiritueux montréalais contrôlé par la famille Bronfman, a déclaré que l'entreprise affichera un bénéfice avant impôt supplémentaire d'environ 33 millions de dollars par an en raison des dividendes supplémentaires du Pont.
0	Du Pont a également annoncé son intention de diviser les actions de 3 pour 1, bien que le dividende initial plus élevé soit versé sur les actions pré-fractionnées.
1	L'action de Du Pont a augmenté de 2,50$ l'action pour clôturer hier à 117,375$ dans le trading composite de la Bourse de New York.
0	Seagram a clôturé à 84,75$, en hausse de 12,5 cents la part du trading Big Board.
1	Le segment des produits industriels, qui a grimpé à 155 millions de dollars contre 99 millions de dollars l'année précédente, était en tête des gains enregistrés pour Du Pont au dernier trimestre.
0	L'entreprise a bénéficié d'une forte demande continue et de prix de vente plus élevés pour le dioxyde de titane, un pigment blanc utilisé dans les peintures, le papier et les plastiques.
0	James Fallon, New Providence, New Jersey, consultant en marketing auprès de l'industrie chimique, affirme que Du Pont a toujours un avantage dans la fabrication du pigment parce que l'entreprise était « la première à avoir la technologie » pour réduire les coûts.
0	Il a déclaré que Du Pont détient environ 23% du marché mondial, la plus grande action unique, à un moment où les utilisations croissantes du pigment l'ont maintenu dans un approvisionnement serré, bien que d'autres ajoutent maintenant une capacité de production à faible coût.
1	Le bénéfice a grimpé à 98 millions de dollars contre 71 millions de dollars dans le segment pétrolier, la compagnie pétrolière Conoco Inc. de Du Pont étant aidée par les prix du pétrole brut plus élevés qu'il y a un an et par la hausse des prix et du volume du gaz naturel.
0	Dans le segment des entreprises diversifiées, qui comprend les herbicides, le bénéfice est passé de 27 millions de dollars à 64 millions de dollars.
1	Un porte-parole a déclaré que l'utilisation d'herbicides dans certaines régions des États-Unis a été retardée plus tôt dans l'année par de fortes pluies, ce qui a augmenté les ventes au troisième trimestre.
0	Dans le segment des fibres, le bénéfice est passé de 155 millions de dollars à 180 millions de dollars, un gain du Pont attribué à la hausse de la demande aux États-Unis pour la plupart des produits textiles.
1	Deux segments ont affiché un bénéfice inférieur pour le trimestre.
0	Le bénéfice du charbon est tombé à 41 millions de dollars, contre 58 millions de dollars, en partie à cause d'une grève des mineurs.
0	Et le bénéfice des polymères a chuté à 107 millions de dollars, passant de 122 millions de dollars, alors que Du Pont a appelé la baisse de la demande et des prix de vente sur certains marchés industriels et de l'emballage.
1	Pendant les neuf mois, Du Pont a gagné 2 milliards de dollars, soit 8,46$ l'action, en hausse de 18 % par rapport à 1,69 milliard de dollars, soit 7,03$ l'action, l'année précédente.
0	Les ventes ont augmenté de 10 % à 26,54 milliards de dollars, contre 24,05 milliards de dollars.
1	L'augmentation du dividende sera versée le 14 décembre aux détenteurs du record.
0	15.
1	Le fractionnement des actions, qui est soumis à l'approbation du titulaire, serait versé à une date non précisée en janvier aux détenteurs du record le 21 décembre.
1	@Jacqhohanyi Lucky Loh... Cette semaine, le week-end de la semaine prochaine va brûler 6 jours
0	#HiCollage @fotorusofficial FOOD STRIP ÉQUIVAUT À UN MASSAGE STRESS.
1	UNE SEMAINE CHEZ LUI UN DUB UN CONCERT D'HÔTE...
0	Accueil chaleureux à l'aéroport de Colombo.
1	J'ai hâte de découvrir le Sri Lanka en plein jour
1	Zoo en famille le jour de Vesak #piccollage
1	Un mercredi si joyeux !
0	Retweetez et dites-nous si vous prévoyez des cours de yoga pendant le déjeuner ou après le travail !
1	Notre toute dernière formation aujourd'hui :( Le bloc C s'unit !
0	Nous avons une fois de plus obtenu la plus haute qualité !
0	C'était un...
1	Un hamburger le matin me fait sentir si aimé.. @sushiqi
1	Aventure Cove avec mon petit livre hier, j'ai passé un très bon moment avec toi bébé.
0	Rappelez-vous que nous avons été...
0	Philip Morris Cos., New York, a adopté une mesure de défense destinée à rendre une prise de contrôle hostile prohibitivement coûteuse.
1	La société géante d'aliments, de tabac et de brasserie a déclaré qu'elle émettra des droits d'achat d'actions ordinaires aux actionnaires enregistrés le 8 novembre.
0	Dans certaines circonstances, les droits permettraient aux détenteurs de Philip Morris d'acheter des actions de la société ou de son acquéreur à moitié prix.
0	Le conseil d'administration n'est au courant d'aucune tentative de reprise de Philip Morris, a déclaré l'entreprise.
1	Au 30 septembre, Philip Morris avait 926 millions d'actions en circulation.
1	Dans le cadre du trading composite à la Bourse de New York, les actions Philip Morris ont clôturé hier à 43,50$ chacune, en baisse de 1$.
1	Sotheby's Holdings Inc., la société mère de la maison de vente aux enchères Sotheby's, a déclaré que sa perte nette pour le troisième trimestre saisonnier s'est rétrécie par rapport à un an plus tôt, suite à une hausse du chiffre d'affaires d'exploitation.
1	La société basée à New York a enregistré une perte nette de 5,1 millions de dollars au troisième trimestre, soit 10 cents l'action, comparativement à une perte nette de 6,2 millions de dollars l'année précédente, soit 12 cents l'action.
1	Le chiffre d'affaires d'exploitation a augmenté de 54 % au cours de la dernière période à 42,9 millions de dollars, contre 27,7 millions de dollars.
1	La société a déclaré que 80 % de ses activités d'enchères se déroulent généralement aux deuxième et quatrième trimestres, le trimestre en cours ayant « très bien commencé ».
1	Ocean Drilling amp Exploration Co. vendra ses activités de forage contractuel et a subi une perte de 50,9 millions de dollars en raison des opérations interrompues au troisième trimestre en raison de la vente prévue.
0	La société d'exploration et d'exploitation de plongée pétrolière et gazière de la Nouvelle-Orléans a ajouté qu'elle ne s'attend à aucun autre impact financier négatif de la restructuration.
1	Au troisième trimestre, la société, détenue à 61 % par Murphy Oil Corp. de l'Arkansas, a subi une perte nette de 46,9 millions de dollars, soit 91 cents l'action, contre 9 millions de dollars, soit 18 cents l'action il y a un an.
1	La dernière période a bénéficié de la poursuite des activités de 4 millions de dollars.
0	Le chiffre d'affaires a augmenté de 13 % à 77,3 millions de dollars, contre 68,5 millions de dollars.
1	Ocean Drilling a indiqué qu'il offrira 15 à 20 % de l'activité de forage sous contrat par le biais d'une offre publique initiale dans un avenir proche.
0	La rumeur dit depuis longtemps qu'Ocean Drilling vendrait l'unité pour se concentrer sur son cœur de métier pétrolier et gazier.
0	Ocean Drilling a déclaré qu'elle ne détiendra aucune action de la nouvelle société après la restructuration.
1	J'ai hâte d'aller pour la soirée Kbox TMR avec @holdingontolove ! ! !
0	C'est trop long ggggg~~~
1	Options Studio Oxley Rise est plein un dimanche !
0	Joignez-vous à notre classe privée individuelle pour obtenir des résultats plus rapides.
0	Envoyez-nous un e-mail à...
0	#SBSAWARDS OMG OMG OMG LEE MIN HO !
0	Ma mère me manque.
1	Est-ce que mardi arrive déjà...
1	Préparez-vous pour une prochaine étape du voyage #Philips in #Singapore avec les festivités révolutionnaires d'aujourd'hui
0	Photo : Aaaaa et nous sommes partis !
1	Livrer #prata à 125 travailleurs de la construction aujourd'hui pour montrer notre appréciation pour...
1	À l'ICA maintenant !
0	Aller à NUS plus tard
1	Pizza festin aujourd'hui pour célébrer Neoyinlan Bday et Neoyingfang pour avoir obtenu de bonnes notes pour elle...
1	#PechaKucha x L'INSEAD 2014 apporte des conférences inspirantes d'entrepreneurs, de meilleurs éducateurs et de leaders de l'impact social
1	à tous les fans de football, souhaitez-vous regarder la finale 2013 de l'UEFA Champions League 2013 « LIVE » ?
1	Bon sang si mon enrôlement a lieu en septembre, je peux participer et m'entraîner pour 1 tournoi de combat de plus.
1	። Il m'a cuisiné Hongkong pour mon mari hier soir.
0	Malgré le fait d'être malade። @ Nadia's Stitchy Home !
1	Photo : Il y a un an, #Singapore souffrait d'une énorme situation #haze et cette situation tombée, oubliée...
1	Le FBI a interviewé et libéré l'un des deux hommes recherchés la semaine dernière pour interrogatoire en lien avec le meurtre d'un médecin dans la région de Buffalo, dans l'État de New York, qui a pratiqué des avortements.
1	Les deux hommes, Ronald Stauber et Michael Gingrich, ont été nommés jeudi dans un bulletin envoyé par le bureau du FBI à Cleveland aux services de police du pays.
1	Les hommes n'étaient pas des suspects, et les responsables du FBI, samedi, ont minimisé la probabilité que l'un ou l'autre ait été impliqué dans le meurtre du médecin Barnett Slepian le 23 octobre.
1	« Nous effectuons des dizaines, voire des centaines d'entretiens par jour », a déclaré Paul Moskal, un porte-parole du bureau du FBI à Buffalo.
1	« Je ne connais aucune information qui traiterait ces deux-là différemment ou les placerait dans n'importe quelle autre catégorie parmi les centaines de pistes que nous étudions quotidiennement. »
0	Moskal a dit que l'un des deux hommes _ il a dit ne pas savoir lequel _ avait été localisé, interviewé et libéré.
1	Dans son numéro de vendredi, The Hamilton (Ontario) Spectator a cité un agent du service de police d'Amherst, dans l'État de New York, qui disait que le FBI.
0	avait indiqué des liens possibles entre les deux hommes et James Charles Kopp, un opposant à l'avortement recherché comme témoin matériel dans l'affaire.
1	Les responsables de la police d'Amherst ont refusé de commenter samedi.
1	Slepian, 52 ans, obstétricien et gynécologue, a été abattu par la fenêtre de la cuisine de son domicile d'Amherst peu après que lui et sa femme sont rentrés de la synagogue dans la nuit du vendredi 23 octobre.
0	Il était l'un des trois médecins qui ont pratiqué des avortements dans la région de Buffalo.
0	Les enquêteurs au Canada et aux États-Unis se penchent également sur quatre autres attaques de tireurs d'élite contre des médecins ayant pratiqué des avortements au Canada et dans l'ouest de New York.
1	Moskal a dit que les deux hommes se sont apparemment présentés chez Slepian le lendemain de sa mort.
0	Ils tentaient d'assister à une veillée de prière pour Slepian mais avaient été envoyés chez lui par erreur, et un policier de service a pris leurs noms, a précisé Moskal.
0	« Ils étaient recherchés pour des entrevues juste parce qu'ils se trouvaient littéralement dans la région après l'homicide », a-t-il dit.
0	Les responsables du FBI ont déclaré ne pas savoir si Stauber ou Gingrich avaient participé à des activités anti-avortement.
0	Les deux hommes vivaient dans la région de Cleveland.
0	L'inspecteur Keith MacCaskill, du Service de police de Winnipeg, membre canadien d'un groupe de travail chargé des forces de l'ordre qui enquête sur les cinq fusillades, a déclaré qu'il n'avait jamais entendu parler des hommes.
0	Moskal a souligné que personne n'a été désigné comme suspect dans la mort de Slepian.
0	« Le simple fait que nous interrogions quelqu'un ne fait pas d'eux un sujet ou un suspect en cela », a-t-il dit.
0	Si vous avez besoin d'un entraîneur personnel.
1	Suivez @chxhizhar pour obtenir des conseils et des astuces pour avoir une figurine en verre d'heure.
0	#forfree
1	J'ai terminé 4 semaines d'entraînement au camp de combat éprouvant qui m'a permis de réaliser le côté cruel et dur des arts martiaux.
1	Marcher dans la rue la plus Noël aujourd'hui avec mes cousins ! !
0	va magasiner, manger et fêter ça :-)... Quels sont vos projets ?
0	Jayark Corp. a accepté de verser 4 millions de dollars en espèces, 2 millions de dollars de débentures convertibles de 12 % et 1,6 million d'actions ordinaires pour acquérir Kofcoh Imports Inc.
1	Dans le commerce en vente libre vendredi, Jayark a été coté à 87,5 cents, en baisse de 15,625 cents.
0	Au prix du marché, la transaction a une valeur totale indiquée de 7,4 millions de dollars.
0	Kofcoh est une holding new-yorkaise pour Rosalco Inc., qui importe des meubles et autres articles.
0	David L. Koffman, président et chef de la direction de Jayark, détient environ 40 % de Kofcoh, a déclaré Jayark.
0	Jayark, New York, distribue et loue du matériel audiovisuel et imprime des publicités promotionnelles pour les détaillants.
1	Au cours du trimestre terminé le 31 juillet, Jayark avait en moyenne 5,6 millions d'actions en circulation.
0	La transaction est soumise à l'approbation d'un panel d'administrateurs désintéressés, a précisé la société, ajoutant que l'approbation des actionnaires n'est pas nécessaire.
1	Rejoignez le photographe professionnel Nikon, Imran Ahmad, pour un après-midi de « LIQUID ART » à Kuala Lumpur...
0	JOYEUX ANNIVERSAIRE joycelyn_n ah ! ! !
1	Ps : maintenant gauche jskpk pas encore anniversaire, slow lah u !
1	Ce mois a été merveilleux de vous avoir au bureau.
0	Vous allez vous manquer tous les deux !
0	Bonne chance...
1	BRUXELLES, 10 février (Xinhua) — L'Organisation du Traité de l'Atlantique Nord (OTAN) a décidé d'admettre la Pologne, la Hongrie et la République tchèque début mars, a indiqué mercredi un responsable de l'organisation.
1	Le responsable a déclaré que l'adhésion était prévue début mars, mais aucune date exacte n'a encore été fixée.
1	Il a ajouté qu'une adhésion cérémonielle aurait toujours lieu lors du sommet de l'OTAN à Washington les 24 et 25 avril.
1	L'adhésion en mars permettra aux trois pays d'être éligibles à la signature des documents du sommet qui comprendront le nouveau concept stratégique de l'alliance et le plan de développement post-Madrid, a ajouté le responsable.
1	L'alliance militaire occidentale a invité les trois pays d'Europe centrale et orientale à rejoindre le bloc des 16 nations en juillet 1997 lors du sommet de Madrid.
1	Les trois pays ont terminé toutes les formalités nécessaires à l'adhésion après que le parlement hongrois a ratifié le traité d'adhésion mardi.
0	Les candidats à l'adhésion à l'OTAN sont également la Roumanie, la Slovénie, la Lettonie, l'Estonie, la Lituanie et la Bulgarie.
0	@Sonanini23 @ImShikaOkay Heheheh !
1	TMR votre dernier article, n'est-ce pas ?
0	Des rafles qui peuvent s'amuser !
1	Comme comment je me débrouille maintenant !
0	@MoltenMuffins @S8DWL Oh, attends une autre histoire.
1	Bouchon de drainage Bionix, pas de drainage du jour de lavage du véhicule.
0	lol
1	Rejoignez le photographe professionnel Nikon, Imran Ahmad en août 2013 à l'occasion du Nikon Day à Singapour, alors qu'il met en valeur le...
1	LE CAP, Afrique du Sud (AP) — Un autre homme a été arrêté dans le cadre des attentats à la bombe perpétrés contre les ambassades américaines au Kenya et en Tanzanie l'année dernière qui ont fait 224 morts, a déclaré la police aujourd'hui.
0	« Je peux confirmer qu'une personne a été arrêtée dans le cadre des attentats à la bombe de l'ambassade et que le FBI a été impliqué », a déclaré le porte-parole de la police le capitaine.
0	Rod Beer a dit.
0	Beer a dit ne pas savoir où se trouvait l'homme ni plus de détails.
0	L'arrestation a porté à neuf le nombre de personnes détenues dans le cadre des attentats à la bombe.
1	Les autorités américaines ont prévu une conférence de presse plus tard aujourd'hui à New York.
1	Le journal Cape Argus a rapporté aujourd'hui qu'un Tanzanien a été arrêté et que les autorités étaient à la recherche de complices.
0	L'Argus a cité Jurie de Wet, responsable de l'immigration, affirmant que les arrestations découlent d'informations concernant des demandes d'asile et de résidence temporaire au Cap.
0	L'ambassade des États-Unis à Pretoria n'a eu aucun commentaire.
0	Dix-sept personnes ont été inculpées dans cette affaire.
0	Huit d'entre eux sont en détention, mais les autres sont restés fugitifs, y compris le radical saoudien Oussama Ben Laden.
1	On ne savait pas immédiatement si l'arrestation annoncée aujourd'hui découlait de l'acte d'accusation.
0	Ben Laden, qui est accusé d'avoir organisé l'attaque, figure sur la liste des 10 plus recherchés du FBI.
0	Une récompense de 5 millions de dollars a été offerte pour sa capture.
1	Les bombes ont explosé presque simultanément le 7 août 1998 dans les ambassades américaines à Nairobi, au Kenya et à Dar es-Salaam, en Tanzanie.
1	Yoga anti-âge avec Prakash Singh Bisht, 19 \ - 20 octobre, Chevron House.
1	Inscrivez-vous dès aujourd'hui pour votre place !
1	En route pour Hong Kong:) va manquer jiamingyooo :( on se voit là-bas dans quelques jours
1	mon icône était une erreur, mais maintenant elle a l'air cool
0	@JeromeThong idk.
1	Peut-être qu'un jour, tu te réveilles en sentant Yolo
1	J'ai été heureux de constater que votre article du Journal du Centenaire du 23 octobre a reconnu le concept du fonds monétaire comme l'un des événements importants du siècle dernier.
1	En fait, il y a environ deux ans, le Journal a répertorié la création du fonds monétaire comme l'un des 10 événements les plus importants du monde de la finance au XXe siècle.
0	Mais le Fonds de réserve, le premier fonds monétaire américain, n'a pas été nommé, ni les créateurs du concept de fonds monétaires, Harry Brown et moi-même.
0	Nous avons innové les rachages téléphoniques, les dividendes quotidiens, l'élimination totale des certificats d'actions et le prix constant d'un dollar par action, qui ont tous été douloureusement pensés et non pas le résultat d'une inadvertance de la part de la SEC.
0	BRUCE R. BENT Président The Reserve Fund New York
0	Photo : Petit déjeuner #selfie.
1	(au 1762 The Gourmet Deli Co)
1	LA HAVANE (AP) — Le père d'Elian Gonzalez a déclaré dans une lettre publiée mercredi qu'il voulait que des diplomates cubains basés à Washington rencontrent son fils de 6 ans à Miami et vérifient son état.
1	« Nous sommes inquiets non seulement de son enlèvement prolongé », a écrit Juan Miguel Gonzalez dans une lettre publiée à la une du quotidien du Parti communiste Granma.
1	« Nous manquons d'informations directes sur les conditions concrètes auxquelles il est soumis dans sa vie quotidienne. »
0	Le gouvernement américain n'a pas répondu immédiatement à cette demande.
0	Il est probable que les proches d'Elian à Miami s'y opposent, qui se battent pour garder le garçon aux États-Unis et qui ont dit penser que Gonzalez est contrôlé par le gouvernement de Fidel Castro.
1	Des centaines d'anciens combattants de la révolution qui a porté Castro au pouvoir il y a 42 ans se sont réunis mercredi soir pour dénoncer les « vers » de Miami qui soutiennent le maintien d'Elian aux États-Unis.
0	Avec Castro et d'autres dirigeants révolutionnaires historiques assis au premier rang du Palais des Conventions de La Havane, une série d'anciennes guérilleros a appelé au retour de « notre Elien » à son père sur l'île communiste.
1	Gonzalez avait écrit une lettre en début de semaine au procureur général Janet Reno, exigeant qu'Elian lui soit rendu et disant qu'il ne reconnaissait pas les tribunaux qui entendaient la bataille de garde à vue.
0	Le ministère de la Justice a déclaré qu'il était en train d'examiner cette lettre.
1	La deuxième lettre de Gonzalez à Reno en deux semaines a été publiée mardi dans Granma.
1	« Je m'oppose formellement aux mesures légales prises ou faites par ceux qui retiennent arbitrairement Elian », a déclaré Gonzalez dans la lettre datée de lundi.
0	Dans la lettre, Gonzalez a dit ne pas reconnaître la compétence du système judiciaire américain, qui pèse une tentative des proches d'Elian à Miami de bloquer son retour à Cuba.
1	Elian est au centre d'une bataille internationale de garde depuis qu'il a été retrouvé sur une chambre à air au large de la côte de la Floride, le 25 novembre.
0	La mère du garçon et 10 autres personnes sont mortes lorsque leur bateau a coulé sur le chemin de Cuba vers les États-Unis.
0	Elian séjourne chez son grand-oncle paternel Lazaro Gonzalez, qui se bat pour garder le garçon avec lui aux États-Unis.
0	Les exilés cubains à Miami disent que la mère du garçon est morte pour lui donner la liberté aux États-Unis, tandis que le gouvernement cubain soutient qu'Elian est mal gardé de son père.
0	``Juan Miguel n'a pas dû écrire la lettre lui-même », a déclaré Armando Gutierrez, porte-parole des proches d'Elian à Miami.
0	« Castro doit rêver que la famille autorise les espions cubains à l'intérieur de la maison de Lazaro Gonzalez. »
1	Les avocats des proches de Miami ont déposé lundi un mémoire devant un tribunal fédéral arguant que le Service de l'immigration et de la naturalisation ne peut pas renvoyer Elian à Cuba sans tenir une audience politique d'asile.
0	Les avocats du gouvernement américain ont décidé de rejeter le procès des parents de Miami, arguant qu'ils n'ont aucune position juridique dans le cas du garçon.
1	L'INS a statué le mois dernier que seul le père d'Elian a le droit de parler au nom du garçon en matière d'immigration.
1	@MarcGrubwork haha no la je fais juste de la boxe et du muay thaï pour l'instant.
0	Je n'appellerais pas ça ma passion, plutôt comme un passe-temps.
0	Que se fait-il de nous ?
0	L'armée va bientôt ?
1	Déjà arrivé à l'aéroport de Gimpo maintenant ~ je veux retourner chez moi... tellement fatigué mais tellement amusant ! ~ Haha !
0	^^
1	BUFFALO, N.Y. (AP) — Le Dr Barnett Slepian, tout juste de retour de la synagogue, chauffait de la soupe dans sa cuisine l'automne dernier lorsqu'il a été abattu d'un seul coup à travers une fenêtre.
